[
    {
        "metadata": {
            "card_name": "HDBank Vietjet Platinum",
            "card_image": "https://cdn.hdbank.com.vn/hdbank-file/product/VJP_new.jpg",
            "url": "https://hdbank.com.vn/vi/personal/product/detail/the/the-tin-dung/hdbank-vietjet-platinum",
            "card_type": "The Tin Dung",
            "category": "banking_cards",
            "bank": "HDBank",
            "last_updated": "2024-11-29"
        },
        "description": "HDBank và Vietjet Air tiếp tục hợp tác ra mắt Thẻ tín dụng đồng thương hiệu cao cấp HDBank Vietjet Platinum. Với những ưu đãi vượt trội về mua sắm, du lịch, đây là giải pháp tài chính đột phá, hứa hẹn mang đến những trải nghiệm cao cấp nhất dành cho khách hàng.",
        "features": {
            "gifts": [
                "Miễn phí thường niên năm đầu"
            ],
            "privileges": [
                "Tặng 5%",
                "khi mua vé máy bay Vietjet Air (tối đa 500.000 đồng/ Giao dịch/ tháng)",
                "Hoàn 0.3%",
                "không giới hạn chi tiêu.",
                "Check in ưu tiên",
                "tại quầy Vietjet Air cho chủ thẻ."
            ],
            "benefits": [
                "Tặng 5% khi mua vé máy bay Vietjet Air, Xem chi tiết",
                "Hoàn tiền 0,3% không giới hạn khi chi tiêu. Xem chi tiết",
                "Bảo hiểm du lịch toàn cầu đến 12 tỷ đồng. Xem chi tiết",
                "Quy tắc bảo hiểm và Mẫu giấy chứng nhận bảo hiểm.",
                "Ưu tiên check-in quầy Vietjet tại sân bay dành cho chủ thẻ.",
                "Giảm đến 30% chi phí đặt phòng, ăn uống hoặc dịch vụ giải trí tại Malibu Vũng Tàu, Golden Bay Đà Nẵng, Furama, Republic Plaza, The Anam…",
                "Giảm đến 50% khi chơi Golf tại hệ thống các sân Đồng Nai Golf, Đà Lạt Palace... ",
                "Chủ thẻ được phục vụ theo hotline VIP 1800 6868 của HDBank.",
                "Trả góp lãi suất 0% tại các đối tác liên kết của HDBank.",
                "Miễn lãi tối đa 55 ngày.",
                "Miễn phí thường niên năm đầu thẻ chính và chủ thẻ phụ.",
                "Hạn mức tín dụng lên đến 10 tỷ đồng.",
                "An toàn bảo mật với chip EMV, công nghệ xác thực thanh toán 3D - Secure."
            ]
        },
        "terms_and_conditions": {
            "conditions": "- Cá nhân từ 18 tuổi trở lên, không bị mất hoặc hạn chế năng lực hành vi dân sự theo quy định của pháp luật.\n- Trường hợp đối tượng phát hành thẻ là người nước ngoài thì phải được phép cư trú tại Việt Nam với thời hạn từ 12 tháng trở lên\n- Xem chi tiết Điều kiện & Điều khoản: tại đây",
            "fees": "- Hạn mức thẻ: Từ 20 triệu đồng\n- Phí phát hành: Miễn phí\n- Phí thường niên: \n+ 990.000 đồng/ năm (Hoàn phí năm đầu)\n+ Hoàn phí thường niên năm đầu cho chủ thẻ phụ (Điều khoản điều kiện theo quy định HDBank)\n- Lãi suất (%/ năm): 29%\n- Tỷ lệ thanh toán tối thiểu: 3%\n- Phí chuyển đổi ngoại tệ: 3%\n- Thời gian miễn lãi tối đa: 55 ngày​\n- Chi tiết Xem tại đây\n",
            "documents": "- CMND/ Hộ chiếu/ Căn cước công dân/ Hộ khẩu/ Giấy xác nhận tạm trú.\n- Hợp đồng lao động Sao kê lương (nếu có).\n- Hồ sơ khác.\n"
        },
        "faqs": {
            "Bí kíp tăng hạn mức tín dụng": "Để tăng hạn mức nhanh chóng thật ra không khó khăn nếu bạn chứng minh được mình là người sở hữu thẻ tín dụng có trách nhiệm. Cụ thể, xuyên suốt quá trình sử dụng thẻ bạn cần:\n\nLuôn thanh toán dư nợ tín dụng đúng hạn.\nTăng thời gian sở hữu thẻ.\nChi tiêu mua sắm thường xuyên.",
            "Hạn mức thẻ tín dụng là gì?": "Hạn mức tín dụng là số tiền tối đa mà tổ chức tín dụng cấp cho bạn để bạn có thể sử dụng trên thẻ tín dụng. Mỗi ngân hàng phát hành thẻ sẽ có hạn mức tín dụng tối thiểu và hạn mức tín dụng tối đa khác nhau cho từng loại thẻ riêng biệt. Thậm chí, khi cùng sử dụng một loại thẻ tín dụng, nhưng hạn mức tín dụng cho từng khách hàng cũng khác nhau.\n",
            "Tính năng của thẻ trả trước?": "Thể hiện màu sắc, cá tính riêng thông qua hình ảnh được tự chọn in trên thẻ\nKhông cần mở tài khoản ngân hàng, tạo thẻ nhanh chóng\nQuản lý chi tiêu hiệu quả, xóa tan nỗi lo về lãi suất và hạn mức thanh toán\nMua sắm thỏa thích, thanh toán dễ dàng\nRút tiền mặt tại tất cả máy ATM của HDBank và trong hệ thống thẻ Napas\nPhạm vi sử dụng: thẻ được sử dụng trong lãnh thổ Việt Nam",
            "Thẻ trả trước là gì?": "Tương tự như thẻ ghi nợ và thẻ tín dụng, thẻ trả trước cho phép bạn thực hiện thanh toán mà không cần tiền mặt hay séc. Không như thẻ tín dụng, bạn không thanh toán trước, trả sau với thẻ trả trước. Thẻ trả trước cũng không kết nối trực tiếp với tài khoản ngân hàng như thẻ ghi nợ. Thẻ trả trước không có giá trị nào cho đến khi bạn cho tiền vào thẻ.",
            "Làm sao để thay đổi hạn mức thẻ tín dụng": "Thông thường bạn có thể chủ động yêu cầu ngân hàng phát hành thẻ xét duyệt cho bạn một hạn mức tín dụng mới, hoặc đăng ký cho phép ngân hàng xét duyệt tự động giúp bạn. Dựa vào các thói quen khi sử dụng thẻ tín dụng, ngân hàng sẽ cân nhắc việc tăng, hoặc giữ nguyên hạn mức tín dụng hiện tại của bạn\n"
        },
        "raw_text": "HDBank và Vietjet Air tiếp tục hợp tác ra mắt Thẻ tín dụng đồng thương hiệu cao cấp HDBank Vietjet Platinum. Với những ưu đãi vượt trội về mua sắm, du lịch, đây là giải pháp tài chính đột phá, hứa hẹn mang đến những trải nghiệm cao cấp nhất dành cho khách hàng. Miễn phí thường niên năm đầu Tặng 5% khi mua vé máy bay Vietjet Air (tối đa 500.000 đồng/ Giao dịch/ tháng) Hoàn 0.3% không giới hạn chi tiêu. Check in ưu tiên tại quầy Vietjet Air cho chủ thẻ. Tặng 5% khi mua vé máy bay Vietjet Air, Xem chi tiết Hoàn tiền 0,3% không giới hạn khi chi tiêu. Xem chi tiết Bảo hiểm du lịch toàn cầu đến 12 tỷ đồng. Xem chi tiết Quy tắc bảo hiểm và Mẫu giấy chứng nhận bảo hiểm. Ưu tiên check-in quầy Vietjet tại sân bay dành cho chủ thẻ. Giảm đến 30% chi phí đặt phòng, ăn uống hoặc dịch vụ giải trí tại Malibu Vũng Tàu, Golden Bay Đà Nẵng, Furama, Republic Plaza, The Anam… Giảm đến 50% khi chơi Golf tại hệ thống các sân Đồng Nai Golf, Đà Lạt Palace...  Chủ thẻ được phục vụ theo hotline VIP 1800 6868 của HDBank. Trả góp lãi suất 0% tại các đối tác liên kết của HDBank. Miễn lãi tối đa 55 ngày. Miễn phí thường niên năm đầu thẻ chính và chủ thẻ phụ. Hạn mức tín dụng lên đến 10 tỷ đồng. An toàn bảo mật với chip EMV, công nghệ xác thực thanh toán 3D - Secure. - Cá nhân từ 18 tuổi trở lên, không bị mất hoặc hạn chế năng lực hành vi dân sự theo quy định của pháp luật.\n- Trường hợp đối tượng phát hành thẻ là người nước ngoài thì phải được phép cư trú tại Việt Nam với thời hạn từ 12 tháng trở lên\n- Xem chi tiết Điều kiện & Điều khoản: tại đây - Hạn mức thẻ: Từ 20 triệu đồng\n- Phí phát hành: Miễn phí\n- Phí thường niên: \n+ 990.000 đồng/ năm (Hoàn phí năm đầu)\n+ Hoàn phí thường niên năm đầu cho chủ thẻ phụ (Điều khoản điều kiện theo quy định HDBank)\n- Lãi suất (%/ năm): 29%\n- Tỷ lệ thanh toán tối thiểu: 3%\n- Phí chuyển đổi ngoại tệ: 3%\n- Thời gian miễn lãi tối đa: 55 ngày​\n- Chi tiết Xem tại đây\n - CMND/ Hộ chiếu/ Căn cước công dân/ Hộ khẩu/ Giấy xác nhận tạm trú.\n- Hợp đồng lao động Sao kê lương (nếu có).\n- Hồ sơ khác.\n Để tăng hạn mức nhanh chóng thật ra không khó khăn nếu bạn chứng minh được mình là người sở hữu thẻ tín dụng có trách nhiệm. Cụ thể, xuyên suốt quá trình sử dụng thẻ bạn cần:\n\nLuôn thanh toán dư nợ tín dụng đúng hạn.\nTăng thời gian sở hữu thẻ.\nChi tiêu mua sắm thường xuyên. Hạn mức tín dụng là số tiền tối đa mà tổ chức tín dụng cấp cho bạn để bạn có thể sử dụng trên thẻ tín dụng. Mỗi ngân hàng phát hành thẻ sẽ có hạn mức tín dụng tối thiểu và hạn mức tín dụng tối đa khác nhau cho từng loại thẻ riêng biệt. Thậm chí, khi cùng sử dụng một loại thẻ tín dụng, nhưng hạn mức tín dụng cho từng khách hàng cũng khác nhau.\n Thể hiện màu sắc, cá tính riêng thông qua hình ảnh được tự chọn in trên thẻ\nKhông cần mở tài khoản ngân hàng, tạo thẻ nhanh chóng\nQuản lý chi tiêu hiệu quả, xóa tan nỗi lo về lãi suất và hạn mức thanh toán\nMua sắm thỏa thích, thanh toán dễ dàng\nRút tiền mặt tại tất cả máy ATM của HDBank và trong hệ thống thẻ Napas\nPhạm vi sử dụng: thẻ được sử dụng trong lãnh thổ Việt Nam Tương tự như thẻ ghi nợ và thẻ tín dụng, thẻ trả trước cho phép bạn thực hiện thanh toán mà không cần tiền mặt hay séc. Không như thẻ tín dụng, bạn không thanh toán trước, trả sau với thẻ trả trước. Thẻ trả trước cũng không kết nối trực tiếp với tài khoản ngân hàng như thẻ ghi nợ. Thẻ trả trước không có giá trị nào cho đến khi bạn cho tiền vào thẻ. Thông thường bạn có thể chủ động yêu cầu ngân hàng phát hành thẻ xét duyệt cho bạn một hạn mức tín dụng mới, hoặc đăng ký cho phép ngân hàng xét duyệt tự động giúp bạn. Dựa vào các thói quen khi sử dụng thẻ tín dụng, ngân hàng sẽ cân nhắc việc tăng, hoặc giữ nguyên hạn mức tín dụng hiện tại của bạn"
    },
    {
        "metadata": {
            "card_name": "HDBank Petrolimex 4in1",
            "card_image": "https://cdn.hdbank.com.vn/hdbank-file/product/PLX_1670905793387.png",
            "url": "https://hdbank.com.vn/vi/personal/product/detail/the/the-tin-dung/hdbank-petrolimex-4in1",
            "card_type": "The Tin Dung",
            "category": "banking_cards",
            "bank": "HDBank",
            "last_updated": "2024-11-29"
        },
        "description": "Thẻ 4 trong 1 đầu tiên tại Châu Á. Tích hợp 03 loại thẻ trong một, gồm: Thẻ tín dụng, Thẻ ghi nợ, Thẻ trả trước định danh, và tài khoản khách hàng thân thiết của Petrolimex (Petrolimex ID). - Dễ dàng rút tiền mặt, chuyển khoản, nhận lương, thanh toán gói gọn trong 1 thẻ. - Tích điểm đổ xăng, đổi quà không giới hạn. - Hạn mức đến 600 triệu đồng.",
        "features": {
            "gifts": [
                "Miễn phí thường niên năm đầu."
            ],
            "privileges": [
                "Mở thẻ 100% online chỉ 10 phút ",
                "không chứng minh thu nhập.",
                "Tất cả trong 1 thẻ, thuận tiện mang theo",
                " ",
                "Tích điểm đổi quà không giới hạn",
                "với mỗi 100.000 đồng giao dịch."
            ],
            "benefits": [
                "Miễn phí thường niên năm đầu",
                "Tích 1 điểm thưởng SkyJoy cho mỗi 100.000 đồng doanh thu giao dịch nội địa.",
                "Tích 2 điểm thưởng SkyJoy cho mỗi 100.000 đồng doanh thu giao dịch quốc tế.",
                "Tích 3 điểm thưởng SkyJoy cho mỗi 100.000 đồng doanh thu giao dịch xăng dầu.",
                "Tặng 500 điểm thưởng SkyJoy khi khách hàng có DSGD từ 10 đến dưới 20 triệu đồng/tháng.",
                "Tặng 1.000 điểm thưởng SkyJoy khi khách hàng có DSGD từ 20 triệu đồng/tháng trở lên.",
                "Mở thẻ 100% trực tuyến, không cần đến ngân hàng.",
                "Chi trước trả sau",
                "Miễn lãi tối đa 45 ngày.",
                "Trả góp 0% lãi suất đến 12 tháng qua ứng dụng HDBank với giao dịch từ 2 triệu đồng.",
                "Bảo mật với chip EMV, công nghệ xác thực thanh toán 3D - Secure."
            ]
        },
        "terms_and_conditions": {
            "conditions": "- Cá nhân từ 18 tuổi trở lên, không bị mất hoặc hạn chế năng lực hành vi dân sự theo quy định của pháp luật.\n- Trường hợp đối tượng phát hành thẻ là người nước ngoài thì phải được phép cư trú tại Việt Nam với thời hạn từ 12 tháng trở lên\n- Xem chi tiết Điều kiện & Điều khoản tại đây",
            "fees": "- Hạn mức thẻ: Lên đến 10 tỷ đồng\n- Phí phát hành: Miễn phí\n- Phí thường niên: \n+ 440.000 đồng/ năm (Hoàn phí thường niên năm đầu*)\n+ Không có thẻ phụ\n- Lãi suất (%/ năm): 36%\n- Tỷ lệ thanh toán tối thiểu: 3%\n- Phí chuyển đổi ngoại tệ: 3%\n- Thời gian miễn lãi tối đa: 45 ngày​\n- Chi tiết Xem tại đây\n",
            "documents": "- CMND/ CCCD/ Passport\n"
        },
        "faqs": {
            "Bí kíp tăng hạn mức tín dụng": "Để tăng hạn mức nhanh chóng thật ra không khó khăn nếu bạn chứng minh được mình là người sở hữu thẻ tín dụng có trách nhiệm. Cụ thể, xuyên suốt quá trình sử dụng thẻ bạn cần:\n\nLuôn thanh toán dư nợ tín dụng đúng hạn.\nTăng thời gian sở hữu thẻ.\nChi tiêu mua sắm thường xuyên.",
            "Hạn mức thẻ tín dụng là gì?": "Hạn mức tín dụng là số tiền tối đa mà tổ chức tín dụng cấp cho bạn để bạn có thể sử dụng trên thẻ tín dụng. Mỗi ngân hàng phát hành thẻ sẽ có hạn mức tín dụng tối thiểu và hạn mức tín dụng tối đa khác nhau cho từng loại thẻ riêng biệt. Thậm chí, khi cùng sử dụng một loại thẻ tín dụng, nhưng hạn mức tín dụng cho từng khách hàng cũng khác nhau.\n",
            "Tính năng của thẻ trả trước?": "Thể hiện màu sắc, cá tính riêng thông qua hình ảnh được tự chọn in trên thẻ\nKhông cần mở tài khoản ngân hàng, tạo thẻ nhanh chóng\nQuản lý chi tiêu hiệu quả, xóa tan nỗi lo về lãi suất và hạn mức thanh toán\nMua sắm thỏa thích, thanh toán dễ dàng\nRút tiền mặt tại tất cả máy ATM của HDBank và trong hệ thống thẻ Napas\nPhạm vi sử dụng: thẻ được sử dụng trong lãnh thổ Việt Nam",
            "Thẻ trả trước là gì?": "Tương tự như thẻ ghi nợ và thẻ tín dụng, thẻ trả trước cho phép bạn thực hiện thanh toán mà không cần tiền mặt hay séc. Không như thẻ tín dụng, bạn không thanh toán trước, trả sau với thẻ trả trước. Thẻ trả trước cũng không kết nối trực tiếp với tài khoản ngân hàng như thẻ ghi nợ. Thẻ trả trước không có giá trị nào cho đến khi bạn cho tiền vào thẻ.",
            "Làm sao để thay đổi hạn mức thẻ tín dụng": "Thông thường bạn có thể chủ động yêu cầu ngân hàng phát hành thẻ xét duyệt cho bạn một hạn mức tín dụng mới, hoặc đăng ký cho phép ngân hàng xét duyệt tự động giúp bạn. Dựa vào các thói quen khi sử dụng thẻ tín dụng, ngân hàng sẽ cân nhắc việc tăng, hoặc giữ nguyên hạn mức tín dụng hiện tại của bạn\n"
        },
        "raw_text": "Thẻ 4 trong 1 đầu tiên tại Châu Á. Tích hợp 03 loại thẻ trong một, gồm: Thẻ tín dụng, Thẻ ghi nợ, Thẻ trả trước định danh, và tài khoản khách hàng thân thiết của Petrolimex (Petrolimex ID). - Dễ dàng rút tiền mặt, chuyển khoản, nhận lương, thanh toán gói gọn trong 1 thẻ. - Tích điểm đổ xăng, đổi quà không giới hạn. - Hạn mức đến 600 triệu đồng. Miễn phí thường niên năm đầu. Mở thẻ 100% online chỉ 10 phút  không chứng minh thu nhập. Tất cả trong 1 thẻ, thuận tiện mang theo   Tích điểm đổi quà không giới hạn với mỗi 100.000 đồng giao dịch. Miễn phí thường niên năm đầu Tích 1 điểm thưởng SkyJoy cho mỗi 100.000 đồng doanh thu giao dịch nội địa. Tích 2 điểm thưởng SkyJoy cho mỗi 100.000 đồng doanh thu giao dịch quốc tế. Tích 3 điểm thưởng SkyJoy cho mỗi 100.000 đồng doanh thu giao dịch xăng dầu. Tặng 500 điểm thưởng SkyJoy khi khách hàng có DSGD từ 10 đến dưới 20 triệu đồng/tháng. Tặng 1.000 điểm thưởng SkyJoy khi khách hàng có DSGD từ 20 triệu đồng/tháng trở lên. Mở thẻ 100% trực tuyến, không cần đến ngân hàng. Chi trước trả sau Miễn lãi tối đa 45 ngày. Trả góp 0% lãi suất đến 12 tháng qua ứng dụng HDBank với giao dịch từ 2 triệu đồng. Bảo mật với chip EMV, công nghệ xác thực thanh toán 3D - Secure. - Cá nhân từ 18 tuổi trở lên, không bị mất hoặc hạn chế năng lực hành vi dân sự theo quy định của pháp luật.\n- Trường hợp đối tượng phát hành thẻ là người nước ngoài thì phải được phép cư trú tại Việt Nam với thời hạn từ 12 tháng trở lên\n- Xem chi tiết Điều kiện & Điều khoản tại đây - Hạn mức thẻ: Lên đến 10 tỷ đồng\n- Phí phát hành: Miễn phí\n- Phí thường niên: \n+ 440.000 đồng/ năm (Hoàn phí thường niên năm đầu*)\n+ Không có thẻ phụ\n- Lãi suất (%/ năm): 36%\n- Tỷ lệ thanh toán tối thiểu: 3%\n- Phí chuyển đổi ngoại tệ: 3%\n- Thời gian miễn lãi tối đa: 45 ngày​\n- Chi tiết Xem tại đây\n - CMND/ CCCD/ Passport\n Để tăng hạn mức nhanh chóng thật ra không khó khăn nếu bạn chứng minh được mình là người sở hữu thẻ tín dụng có trách nhiệm. Cụ thể, xuyên suốt quá trình sử dụng thẻ bạn cần:\n\nLuôn thanh toán dư nợ tín dụng đúng hạn.\nTăng thời gian sở hữu thẻ.\nChi tiêu mua sắm thường xuyên. Hạn mức tín dụng là số tiền tối đa mà tổ chức tín dụng cấp cho bạn để bạn có thể sử dụng trên thẻ tín dụng. Mỗi ngân hàng phát hành thẻ sẽ có hạn mức tín dụng tối thiểu và hạn mức tín dụng tối đa khác nhau cho từng loại thẻ riêng biệt. Thậm chí, khi cùng sử dụng một loại thẻ tín dụng, nhưng hạn mức tín dụng cho từng khách hàng cũng khác nhau.\n Thể hiện màu sắc, cá tính riêng thông qua hình ảnh được tự chọn in trên thẻ\nKhông cần mở tài khoản ngân hàng, tạo thẻ nhanh chóng\nQuản lý chi tiêu hiệu quả, xóa tan nỗi lo về lãi suất và hạn mức thanh toán\nMua sắm thỏa thích, thanh toán dễ dàng\nRút tiền mặt tại tất cả máy ATM của HDBank và trong hệ thống thẻ Napas\nPhạm vi sử dụng: thẻ được sử dụng trong lãnh thổ Việt Nam Tương tự như thẻ ghi nợ và thẻ tín dụng, thẻ trả trước cho phép bạn thực hiện thanh toán mà không cần tiền mặt hay séc. Không như thẻ tín dụng, bạn không thanh toán trước, trả sau với thẻ trả trước. Thẻ trả trước cũng không kết nối trực tiếp với tài khoản ngân hàng như thẻ ghi nợ. Thẻ trả trước không có giá trị nào cho đến khi bạn cho tiền vào thẻ. Thông thường bạn có thể chủ động yêu cầu ngân hàng phát hành thẻ xét duyệt cho bạn một hạn mức tín dụng mới, hoặc đăng ký cho phép ngân hàng xét duyệt tự động giúp bạn. Dựa vào các thói quen khi sử dụng thẻ tín dụng, ngân hàng sẽ cân nhắc việc tăng, hoặc giữ nguyên hạn mức tín dụng hiện tại của bạn"
    },
    {
        "metadata": {
            "card_name": "HDBank Vietjet Classic",
            "card_image": "https://cdn.hdbank.com.vn/hdbank-file/product/VJC_new.jpg",
            "url": "https://hdbank.com.vn/vi/personal/product/detail/the/the-tin-dung/hdbank-vietjet-classic",
            "card_type": "The Tin Dung",
            "category": "banking_cards",
            "bank": "HDBank",
            "last_updated": "2024-11-29"
        },
        "description": "Thẻ tín dụng đồng thương hiệu HDBank Vietjet Classic VISA còn mang đến cho khách hàng nhiều trãi nghiệm: miễn lãi tối đa 45 ngày,tích điểm đổi quà không giới hạn chi tiêu, dễ dàng quản lý và kiểm soát mọi chi tiêu thông qua bảng sao kê giao dịch hàng tháng và dịch vụ SMS Banking.",
        "features": {
            "gifts": [
                "Miễn phí thường niên năm đầu"
            ],
            "privileges": [
                " Tích điểm SkyJoy không giới hạn.",
                " ",
                "Trả góp 0% lãi suất",
                "tại các đối tác liên kết HDBank.",
                "Miễn phí thường niên năm đầu\n ",
                " "
            ],
            "benefits": [
                "Tích 1 điểm thưởng SkyJoy cho mỗi 100.000 đồng doanh thu giao dịch nội địa.",
                "Tích 5 điểm thưởng SkyJoy cho mỗi 100.000 đồng doanh thu giao dịch quốc tế.",
                "Dễ dàng quản lý và kiểm soát mọi chi tiêu thông qua bảng sao kê giao dịch hàng tháng và dịch vụ SMS Banking.",
                "Bảo đảm an toàn và thuận tiện hơn mang tiền mặt.",
                "Tận hưởng các ưu đãi, chiết khấu thanh toán từ “Happy Zone” của HDBank và tổ chức thẻ Visa.",
                "Trả góp lãi suất 0% tại các đối tác liên kết của HDBank",
                "Miễn lãi tối đa 45 ngày.",
                "Miễn phí thường niên năm đầu tiên dành cho Chủ thẻ phụ",
                "An toàn bảo mật với chip EMV, công nghệ xác thực thanh toán 3D - Secure."
            ]
        },
        "terms_and_conditions": {
            "conditions": "- Cá nhân từ 18 tuổi trở lên, không bị mất hoặc hạn chế năng lực hành vi dân sự theo quy định của pháp luật.\n- Trường hợp đối tượng phát hành thẻ là người nước ngoài thì phải được phép cư trú tại Việt Nam với thời hạn từ 12 tháng trở lên\n- Xem chi tiết Điều kiện & Điều khoản: tại đây",
            "fees": "- Hạn mức thẻ: Đến 50 triệu đồng\n- Phí phát hành: Miễn phí\n- Phí thường niên: 220.000 đồng/ năm (miễn phí năm đầu)\n- Lãi suất (%/ năm): 36%\n- Tỷ lệ thanh toán tối thiểu: 3%\n- Phí chuyển đổi ngoại tệ: 3%\n- Thời gian miễn lãi tối đa: 45 ngày​\n- Chi tiết Xem tại đây\n",
            "documents": "- CMND/ Hộ chiếu/ Căn cước công dân/ Hộ khẩu/ Giấy xác nhận tạm trú.\n- Hợp đồng lao động Sao kê lương (nếu có).\n- Hồ sơ khác.\n"
        },
        "faqs": {
            "Bí kíp tăng hạn mức tín dụng": "Để tăng hạn mức nhanh chóng thật ra không khó khăn nếu bạn chứng minh được mình là người sở hữu thẻ tín dụng có trách nhiệm. Cụ thể, xuyên suốt quá trình sử dụng thẻ bạn cần:\n\nLuôn thanh toán dư nợ tín dụng đúng hạn.\nTăng thời gian sở hữu thẻ.\nChi tiêu mua sắm thường xuyên.",
            "Hạn mức thẻ tín dụng là gì?": "Hạn mức tín dụng là số tiền tối đa mà tổ chức tín dụng cấp cho bạn để bạn có thể sử dụng trên thẻ tín dụng. Mỗi ngân hàng phát hành thẻ sẽ có hạn mức tín dụng tối thiểu và hạn mức tín dụng tối đa khác nhau cho từng loại thẻ riêng biệt. Thậm chí, khi cùng sử dụng một loại thẻ tín dụng, nhưng hạn mức tín dụng cho từng khách hàng cũng khác nhau.\n",
            "Tính năng của thẻ trả trước?": "Thể hiện màu sắc, cá tính riêng thông qua hình ảnh được tự chọn in trên thẻ\nKhông cần mở tài khoản ngân hàng, tạo thẻ nhanh chóng\nQuản lý chi tiêu hiệu quả, xóa tan nỗi lo về lãi suất và hạn mức thanh toán\nMua sắm thỏa thích, thanh toán dễ dàng\nRút tiền mặt tại tất cả máy ATM của HDBank và trong hệ thống thẻ Napas\nPhạm vi sử dụng: thẻ được sử dụng trong lãnh thổ Việt Nam",
            "Thẻ trả trước là gì?": "Tương tự như thẻ ghi nợ và thẻ tín dụng, thẻ trả trước cho phép bạn thực hiện thanh toán mà không cần tiền mặt hay séc. Không như thẻ tín dụng, bạn không thanh toán trước, trả sau với thẻ trả trước. Thẻ trả trước cũng không kết nối trực tiếp với tài khoản ngân hàng như thẻ ghi nợ. Thẻ trả trước không có giá trị nào cho đến khi bạn cho tiền vào thẻ.",
            "Làm sao để thay đổi hạn mức thẻ tín dụng": "Thông thường bạn có thể chủ động yêu cầu ngân hàng phát hành thẻ xét duyệt cho bạn một hạn mức tín dụng mới, hoặc đăng ký cho phép ngân hàng xét duyệt tự động giúp bạn. Dựa vào các thói quen khi sử dụng thẻ tín dụng, ngân hàng sẽ cân nhắc việc tăng, hoặc giữ nguyên hạn mức tín dụng hiện tại của bạn\n"
        },
        "raw_text": "Thẻ tín dụng đồng thương hiệu HDBank Vietjet Classic VISA còn mang đến cho khách hàng nhiều trãi nghiệm: miễn lãi tối đa 45 ngày,tích điểm đổi quà không giới hạn chi tiêu, dễ dàng quản lý và kiểm soát mọi chi tiêu thông qua bảng sao kê giao dịch hàng tháng và dịch vụ SMS Banking. Miễn phí thường niên năm đầu  Tích điểm SkyJoy không giới hạn.   Trả góp 0% lãi suất tại các đối tác liên kết HDBank. Miễn phí thường niên năm đầu\n    Tích 1 điểm thưởng SkyJoy cho mỗi 100.000 đồng doanh thu giao dịch nội địa. Tích 5 điểm thưởng SkyJoy cho mỗi 100.000 đồng doanh thu giao dịch quốc tế. Dễ dàng quản lý và kiểm soát mọi chi tiêu thông qua bảng sao kê giao dịch hàng tháng và dịch vụ SMS Banking. Bảo đảm an toàn và thuận tiện hơn mang tiền mặt. Tận hưởng các ưu đãi, chiết khấu thanh toán từ “Happy Zone” của HDBank và tổ chức thẻ Visa. Trả góp lãi suất 0% tại các đối tác liên kết của HDBank Miễn lãi tối đa 45 ngày. Miễn phí thường niên năm đầu tiên dành cho Chủ thẻ phụ An toàn bảo mật với chip EMV, công nghệ xác thực thanh toán 3D - Secure. - Cá nhân từ 18 tuổi trở lên, không bị mất hoặc hạn chế năng lực hành vi dân sự theo quy định của pháp luật.\n- Trường hợp đối tượng phát hành thẻ là người nước ngoài thì phải được phép cư trú tại Việt Nam với thời hạn từ 12 tháng trở lên\n- Xem chi tiết Điều kiện & Điều khoản: tại đây - Hạn mức thẻ: Đến 50 triệu đồng\n- Phí phát hành: Miễn phí\n- Phí thường niên: 220.000 đồng/ năm (miễn phí năm đầu)\n- Lãi suất (%/ năm): 36%\n- Tỷ lệ thanh toán tối thiểu: 3%\n- Phí chuyển đổi ngoại tệ: 3%\n- Thời gian miễn lãi tối đa: 45 ngày​\n- Chi tiết Xem tại đây\n - CMND/ Hộ chiếu/ Căn cước công dân/ Hộ khẩu/ Giấy xác nhận tạm trú.\n- Hợp đồng lao động Sao kê lương (nếu có).\n- Hồ sơ khác.\n Để tăng hạn mức nhanh chóng thật ra không khó khăn nếu bạn chứng minh được mình là người sở hữu thẻ tín dụng có trách nhiệm. Cụ thể, xuyên suốt quá trình sử dụng thẻ bạn cần:\n\nLuôn thanh toán dư nợ tín dụng đúng hạn.\nTăng thời gian sở hữu thẻ.\nChi tiêu mua sắm thường xuyên. Hạn mức tín dụng là số tiền tối đa mà tổ chức tín dụng cấp cho bạn để bạn có thể sử dụng trên thẻ tín dụng. Mỗi ngân hàng phát hành thẻ sẽ có hạn mức tín dụng tối thiểu và hạn mức tín dụng tối đa khác nhau cho từng loại thẻ riêng biệt. Thậm chí, khi cùng sử dụng một loại thẻ tín dụng, nhưng hạn mức tín dụng cho từng khách hàng cũng khác nhau.\n Thể hiện màu sắc, cá tính riêng thông qua hình ảnh được tự chọn in trên thẻ\nKhông cần mở tài khoản ngân hàng, tạo thẻ nhanh chóng\nQuản lý chi tiêu hiệu quả, xóa tan nỗi lo về lãi suất và hạn mức thanh toán\nMua sắm thỏa thích, thanh toán dễ dàng\nRút tiền mặt tại tất cả máy ATM của HDBank và trong hệ thống thẻ Napas\nPhạm vi sử dụng: thẻ được sử dụng trong lãnh thổ Việt Nam Tương tự như thẻ ghi nợ và thẻ tín dụng, thẻ trả trước cho phép bạn thực hiện thanh toán mà không cần tiền mặt hay séc. Không như thẻ tín dụng, bạn không thanh toán trước, trả sau với thẻ trả trước. Thẻ trả trước cũng không kết nối trực tiếp với tài khoản ngân hàng như thẻ ghi nợ. Thẻ trả trước không có giá trị nào cho đến khi bạn cho tiền vào thẻ. Thông thường bạn có thể chủ động yêu cầu ngân hàng phát hành thẻ xét duyệt cho bạn một hạn mức tín dụng mới, hoặc đăng ký cho phép ngân hàng xét duyệt tự động giúp bạn. Dựa vào các thói quen khi sử dụng thẻ tín dụng, ngân hàng sẽ cân nhắc việc tăng, hoặc giữ nguyên hạn mức tín dụng hiện tại của bạn"
    },
    {
        "metadata": {
            "card_name": "Thẻ HDBank Priority – Tinh Tú Phương Đông",
            "card_image": "https://cdn.hdbank.com.vn/hdbank-file/product/VSCardFace_1683689331729.png",
            "url": "https://hdbank.com.vn/vi/personal/product/detail/the/the-tin-dung/the-hdbank-priority-visa-signature",
            "card_type": "The Tin Dung",
            "category": "banking_cards",
            "bank": "HDBank",
            "last_updated": "2024-11-29"
        },
        "description": "Thẻ tín dụng đen HDBank Priority với ưu đãi hoàn tiền đến 9.6 triệu đồng/năm, giảm 57% khi chơi Golf tại sân Đồng Nai Golf, Đà Lạt Palace, miến lãi tối đa 55 ngày",
        "features": {
            "gifts": [
                "Miễn phí thường niên năm đầu"
            ],
            "privileges": [
                "Giảm giá lên đến 50%",
                "Khi chơi Golf tại câu lạc bộ liên kết của HDBank.",
                "Hoàn tiền 15%",
                "Mua sắm hàng hóa.",
                "Hoàn tiền 0,5%",
                "Cho các giao dịch chi tiêu khác."
            ],
            "benefits": [
                "Hoàn tiền 15% cho giao dịch mua sắm hàng hóa với giá trị hoàn tối thiểu 100.000 đồng/ tháng, và  tối đa 300.000 đồng/ tháng.",
                "Tìm hiểu chi tiết mã loại hình mua sắm được hoàn  xem tại đây.",
                "Hoàn tiền 0,5% cho các giao dịch chi tiêu khác như y tế, giáo dục, bảo hiểm... giá trị hoàn tối thiểu 100.000 đồng/ tháng, tối đa 500.000 đồng/ tháng.",
                "Đặc quyền theo quý: Chủ thẻ có tổng giao dịch hằng Quý mỗi 100.000.000 đồng sẽ nhận được một (01) lượt vào phòng chờ sân bay hoặc giảm 1.000.000 đồng (đã bao gồm thuế GTGT) cho một (01) lượt chơi tại sân Golf có liên kết với HDBank. Số lượt được tặng tối đa 4 lượt/năm. Xem chi tiết tại đây.",
                "Bảo hiểm du lịch toàn cầu đến 12 tỷ đồng. Xem chi tiết Quy tắc bảo hiểm và Mẫu giấy chứng nhận bảo hiểm.",
                "Giảm đến 40% chi phí đặt phòng, ăn uống hoặc dịch vụ giải trí tại Pullman Phú Quốc, Aria Đà Nẵng, Royal Hạ Long Hotel,  L'Alya Ninh Van Bay, Almanity Hoi An Resort & Spa, Hệ thống F&B Mylife Group, Miss Thu Restaurant,..",
                "Giảm đến 50% khi chơi Golf tại hệ thống các FCL,sân Cửa Lo Golf, Lang Cô Laguna... ",
                "Chủ thẻ được phục vụ theo hotline VIP 1800 6868 của HDBank.",
                "Trả góp lãi suất 0% tại các đối tác liên kết của HDBank.",
                "Miễn lãi tối đa 55 ngày.",
                "Miễn phí thường niên năm đầu tiên với giá trị đến 1,9 triệu đồng.",
                "Miễn phí thường niên năm đầu tiên dành cho Chủ thẻ phụ.",
                "Hạn mức tín dụng từ 100 triệu đến 10 tỷ đồng.",
                "An toàn bảo mật với chip EMV, công nghệ xác thực thanh toán 3D - Secure."
            ]
        },
        "terms_and_conditions": {
            "conditions": "- Cá nhân từ 18 tuổi trở lên, không bị mất hoặc hạn chế năng lực hành vi dân sự theo quy định của pháp luật.\n- Trường hợp đối tượng phát hành thẻ là người nước ngoài thì phải được phép cư trú tại Việt Nam với thời hạn từ 12 tháng trở lên\n- Xem chi tiết Điều kiện & Điều khoản: tại đây",
            "fees": "- Hạn mức thẻ: Từ 100 triệu đồng\n- Phí phát hành: Miễn phí\n- Phí thường niên: 1.900.000 đồng/ năm (Miễn phí năm đầu)\n- Lãi suất (%/ năm): 28%\n- Tỷ lệ thanh toán tối thiểu: 3%\n- Phí chuyển đổi ngoại tệ: 3%\n- Thời gian miễn lãi tối đa: 55 ngày\n- Xem chi tiết tại đây\n",
            "documents": "Đề nghị phát hành thẻ tín dụng quốc tế dành cho khách hàng cá nhân: \n- CMND/ Hộ chiếu/ Căn cước công dân/ Hộ khẩu/ Giấy xác nhận tạm trú.\n- Hợp đồng lao động, Sao kê lương (nếu có).\n- Hồ sơ khác theo yêu cầu cung cấp của đơn vị tiếp nhận xét duyệt hồ sơ tín dụng.\n"
        },
        "faqs": {
            "Bí kíp tăng hạn mức tín dụng": "Để tăng hạn mức nhanh chóng thật ra không khó khăn nếu bạn chứng minh được mình là người sở hữu thẻ tín dụng có trách nhiệm. Cụ thể, xuyên suốt quá trình sử dụng thẻ bạn cần:\n\nLuôn thanh toán dư nợ tín dụng đúng hạn.\nTăng thời gian sở hữu thẻ.\nChi tiêu mua sắm thường xuyên.",
            "Hạn mức thẻ tín dụng là gì?": "Hạn mức tín dụng là số tiền tối đa mà tổ chức tín dụng cấp cho bạn để bạn có thể sử dụng trên thẻ tín dụng. Mỗi ngân hàng phát hành thẻ sẽ có hạn mức tín dụng tối thiểu và hạn mức tín dụng tối đa khác nhau cho từng loại thẻ riêng biệt. Thậm chí, khi cùng sử dụng một loại thẻ tín dụng, nhưng hạn mức tín dụng cho từng khách hàng cũng khác nhau.\n",
            "Tính năng của thẻ trả trước?": "Thể hiện màu sắc, cá tính riêng thông qua hình ảnh được tự chọn in trên thẻ\nKhông cần mở tài khoản ngân hàng, tạo thẻ nhanh chóng\nQuản lý chi tiêu hiệu quả, xóa tan nỗi lo về lãi suất và hạn mức thanh toán\nMua sắm thỏa thích, thanh toán dễ dàng\nRút tiền mặt tại tất cả máy ATM của HDBank và trong hệ thống thẻ Napas\nPhạm vi sử dụng: thẻ được sử dụng trong lãnh thổ Việt Nam",
            "Thẻ trả trước là gì?": "Tương tự như thẻ ghi nợ và thẻ tín dụng, thẻ trả trước cho phép bạn thực hiện thanh toán mà không cần tiền mặt hay séc. Không như thẻ tín dụng, bạn không thanh toán trước, trả sau với thẻ trả trước. Thẻ trả trước cũng không kết nối trực tiếp với tài khoản ngân hàng như thẻ ghi nợ. Thẻ trả trước không có giá trị nào cho đến khi bạn cho tiền vào thẻ.",
            "Làm sao để thay đổi hạn mức thẻ tín dụng": "Thông thường bạn có thể chủ động yêu cầu ngân hàng phát hành thẻ xét duyệt cho bạn một hạn mức tín dụng mới, hoặc đăng ký cho phép ngân hàng xét duyệt tự động giúp bạn. Dựa vào các thói quen khi sử dụng thẻ tín dụng, ngân hàng sẽ cân nhắc việc tăng, hoặc giữ nguyên hạn mức tín dụng hiện tại của bạn\n"
        },
        "raw_text": "Thẻ tín dụng đen HDBank Priority với ưu đãi hoàn tiền đến 9.6 triệu đồng/năm, giảm 57% khi chơi Golf tại sân Đồng Nai Golf, Đà Lạt Palace, miến lãi tối đa 55 ngày Miễn phí thường niên năm đầu Giảm giá lên đến 50% Khi chơi Golf tại câu lạc bộ liên kết của HDBank. Hoàn tiền 15% Mua sắm hàng hóa. Hoàn tiền 0,5% Cho các giao dịch chi tiêu khác. Hoàn tiền 15% cho giao dịch mua sắm hàng hóa với giá trị hoàn tối thiểu 100.000 đồng/ tháng, và  tối đa 300.000 đồng/ tháng. Tìm hiểu chi tiết mã loại hình mua sắm được hoàn  xem tại đây. Hoàn tiền 0,5% cho các giao dịch chi tiêu khác như y tế, giáo dục, bảo hiểm... giá trị hoàn tối thiểu 100.000 đồng/ tháng, tối đa 500.000 đồng/ tháng. Đặc quyền theo quý: Chủ thẻ có tổng giao dịch hằng Quý mỗi 100.000.000 đồng sẽ nhận được một (01) lượt vào phòng chờ sân bay hoặc giảm 1.000.000 đồng (đã bao gồm thuế GTGT) cho một (01) lượt chơi tại sân Golf có liên kết với HDBank. Số lượt được tặng tối đa 4 lượt/năm. Xem chi tiết tại đây. Bảo hiểm du lịch toàn cầu đến 12 tỷ đồng. Xem chi tiết Quy tắc bảo hiểm và Mẫu giấy chứng nhận bảo hiểm. Giảm đến 40% chi phí đặt phòng, ăn uống hoặc dịch vụ giải trí tại Pullman Phú Quốc, Aria Đà Nẵng, Royal Hạ Long Hotel,  L'Alya Ninh Van Bay, Almanity Hoi An Resort & Spa, Hệ thống F&B Mylife Group, Miss Thu Restaurant,.. Giảm đến 50% khi chơi Golf tại hệ thống các FCL,sân Cửa Lo Golf, Lang Cô Laguna...  Chủ thẻ được phục vụ theo hotline VIP 1800 6868 của HDBank. Trả góp lãi suất 0% tại các đối tác liên kết của HDBank. Miễn lãi tối đa 55 ngày. Miễn phí thường niên năm đầu tiên với giá trị đến 1,9 triệu đồng. Miễn phí thường niên năm đầu tiên dành cho Chủ thẻ phụ. Hạn mức tín dụng từ 100 triệu đến 10 tỷ đồng. An toàn bảo mật với chip EMV, công nghệ xác thực thanh toán 3D - Secure. - Cá nhân từ 18 tuổi trở lên, không bị mất hoặc hạn chế năng lực hành vi dân sự theo quy định của pháp luật.\n- Trường hợp đối tượng phát hành thẻ là người nước ngoài thì phải được phép cư trú tại Việt Nam với thời hạn từ 12 tháng trở lên\n- Xem chi tiết Điều kiện & Điều khoản: tại đây - Hạn mức thẻ: Từ 100 triệu đồng\n- Phí phát hành: Miễn phí\n- Phí thường niên: 1.900.000 đồng/ năm (Miễn phí năm đầu)\n- Lãi suất (%/ năm): 28%\n- Tỷ lệ thanh toán tối thiểu: 3%\n- Phí chuyển đổi ngoại tệ: 3%\n- Thời gian miễn lãi tối đa: 55 ngày\n- Xem chi tiết tại đây\n Đề nghị phát hành thẻ tín dụng quốc tế dành cho khách hàng cá nhân: \n- CMND/ Hộ chiếu/ Căn cước công dân/ Hộ khẩu/ Giấy xác nhận tạm trú.\n- Hợp đồng lao động, Sao kê lương (nếu có).\n- Hồ sơ khác theo yêu cầu cung cấp của đơn vị tiếp nhận xét duyệt hồ sơ tín dụng.\n Để tăng hạn mức nhanh chóng thật ra không khó khăn nếu bạn chứng minh được mình là người sở hữu thẻ tín dụng có trách nhiệm. Cụ thể, xuyên suốt quá trình sử dụng thẻ bạn cần:\n\nLuôn thanh toán dư nợ tín dụng đúng hạn.\nTăng thời gian sở hữu thẻ.\nChi tiêu mua sắm thường xuyên. Hạn mức tín dụng là số tiền tối đa mà tổ chức tín dụng cấp cho bạn để bạn có thể sử dụng trên thẻ tín dụng. Mỗi ngân hàng phát hành thẻ sẽ có hạn mức tín dụng tối thiểu và hạn mức tín dụng tối đa khác nhau cho từng loại thẻ riêng biệt. Thậm chí, khi cùng sử dụng một loại thẻ tín dụng, nhưng hạn mức tín dụng cho từng khách hàng cũng khác nhau.\n Thể hiện màu sắc, cá tính riêng thông qua hình ảnh được tự chọn in trên thẻ\nKhông cần mở tài khoản ngân hàng, tạo thẻ nhanh chóng\nQuản lý chi tiêu hiệu quả, xóa tan nỗi lo về lãi suất và hạn mức thanh toán\nMua sắm thỏa thích, thanh toán dễ dàng\nRút tiền mặt tại tất cả máy ATM của HDBank và trong hệ thống thẻ Napas\nPhạm vi sử dụng: thẻ được sử dụng trong lãnh thổ Việt Nam Tương tự như thẻ ghi nợ và thẻ tín dụng, thẻ trả trước cho phép bạn thực hiện thanh toán mà không cần tiền mặt hay séc. Không như thẻ tín dụng, bạn không thanh toán trước, trả sau với thẻ trả trước. Thẻ trả trước cũng không kết nối trực tiếp với tài khoản ngân hàng như thẻ ghi nợ. Thẻ trả trước không có giá trị nào cho đến khi bạn cho tiền vào thẻ. Thông thường bạn có thể chủ động yêu cầu ngân hàng phát hành thẻ xét duyệt cho bạn một hạn mức tín dụng mới, hoặc đăng ký cho phép ngân hàng xét duyệt tự động giúp bạn. Dựa vào các thói quen khi sử dụng thẻ tín dụng, ngân hàng sẽ cân nhắc việc tăng, hoặc giữ nguyên hạn mức tín dụng hiện tại của bạn"
    },
    {
        "metadata": {
            "card_name": "HDBank JCB Ultimate",
            "card_image": "https://cdn.hdbank.com.vn/hdbank-file/product/JCBCardFront218x346_1703205889248.png",
            "url": "https://hdbank.com.vn/vi/personal/product/detail/the/the-tin-dung/hdbank-jcb-ultimate",
            "card_type": "The Tin Dung",
            "category": "banking_cards",
            "bank": "HDBank",
            "last_updated": "2024-11-29"
        },
        "description": "Sản phẩm thẻ tín dụng HDBank JCB Ultimate mang sắc màu vương giả và biểu tượng hoa đồng tiền may mắn, được thiết kế tính năng và quyền lợi xứng tầm với phân khúc khách hàng cao cấp, sở hữu và theo đuổi phong thái DẪN ĐẦU. Thẻ tín dụng HDBank JCB Ultimate chính là BIỂU TƯỢNG THÀNH CÔNG, hứa hẹn sẽ mở ra những TRẢI NGHIỆM VÔ HẠN dành cho Quý khách. &nbsp;",
        "features": {
            "gifts": [],
            "privileges": [
                "Hoàn đến 20%",
                "khi chi tiêu tại Nhật Bản.",
                "Hoàn đến 15%",
                "khi chi tiêu du lịch, khách sạn, resort.",
                "Hoàn đến 6%",
                "giao dịch quốc tế."
            ],
            "benefits": [
                "Đặc quyền hoàn tiền theo tháng cho thẻ tín dụng HDBank JCB Ultimate ",
                "Đặc quyền ưu đãi theo quý: Khách hàng đạt tổng doanh số giao dịch tối thiểu là 100 triệu đồng/quý sẽ nhận được 01 lượt ưu đãi phí chơi Golf/quý, tối đa 4 lượt ưu đãi/năm. Trị giá ưu đãi nhận được tối đa 1.000.000 đồng/lượt (đã bao gồm VAT). Doanh số giao dịch để xét nhận ưu đãi được tính theo quý, không được cộng dồn qua quý tiếp theo. ",
                "Bảo hiểm du lịch toàn cầu lên đến 12 tỷ đồng. Xem chi tiết Quy tắc bảo hiểm và Mẫu giấy chứng nhận bảo hiểm ",
                "Chủ thẻ được phục vụ theo hotline VIP 1800 6868 của HDBank. ",
                "Trả góp lãi suất 0% tại các đối tác liên kết của HDBank. ",
                "Đặc quyền ưu đãi từ Tổ chức thẻ JCB  ",
                "Miễn lãi tối đa 55 ngày ",
                "Miễn phí thường niên năm đầu tiên với giá trị đến 2 triệu đồng ",
                "Miễn phí thường niên năm đầu tiên dành cho Chủ thẻ phụ",
                "An toàn bảo mật với chip EMV, công nghệ xác thực thanh toán 3D-Secure. "
            ]
        },
        "terms_and_conditions": {
            "conditions": "Cá nhân từ 18 tuổi trở lên, không bị mất hoặc hạn chế năng lực hành vi dân sự theo quy định của pháp luật. \nTrường hợp đối tượng phát hành thẻ là người nước ngoài thì phải được phép cư trú tại Việt Nam với thời hạn từ 12 tháng trở lên. \nXem chi tiết Điều kiện & Điều khoản: tại đây",
            "fees": "Xem Tại đây\n",
            "documents": "\n\tĐề nghị phát hành thẻ tín dụng quốc tế dành cho khách hàng cá nhân: \n\tCMND/ Hộ chiếu/ Căn cước công dân/ Hộ khẩu/ Giấy xác nhận tạm trú. \n\tHợp đồng lao động, Sao kê lương (nếu có). \n\tHồ sơ khác theo yêu cầu cung cấp của đơn vị tiếp nhận xét duyệt hồ sơ tín dụng. \n\n"
        },
        "faqs": {
            "Bí kíp tăng hạn mức tín dụng": "Để tăng hạn mức nhanh chóng thật ra không khó khăn nếu bạn chứng minh được mình là người sở hữu thẻ tín dụng có trách nhiệm. Cụ thể, xuyên suốt quá trình sử dụng thẻ bạn cần:\n\nLuôn thanh toán dư nợ tín dụng đúng hạn.\nTăng thời gian sở hữu thẻ.\nChi tiêu mua sắm thường xuyên.",
            "Hạn mức thẻ tín dụng là gì?": "Hạn mức tín dụng là số tiền tối đa mà tổ chức tín dụng cấp cho bạn để bạn có thể sử dụng trên thẻ tín dụng. Mỗi ngân hàng phát hành thẻ sẽ có hạn mức tín dụng tối thiểu và hạn mức tín dụng tối đa khác nhau cho từng loại thẻ riêng biệt. Thậm chí, khi cùng sử dụng một loại thẻ tín dụng, nhưng hạn mức tín dụng cho từng khách hàng cũng khác nhau.\n",
            "Tính năng của thẻ trả trước?": "Thể hiện màu sắc, cá tính riêng thông qua hình ảnh được tự chọn in trên thẻ\nKhông cần mở tài khoản ngân hàng, tạo thẻ nhanh chóng\nQuản lý chi tiêu hiệu quả, xóa tan nỗi lo về lãi suất và hạn mức thanh toán\nMua sắm thỏa thích, thanh toán dễ dàng\nRút tiền mặt tại tất cả máy ATM của HDBank và trong hệ thống thẻ Napas\nPhạm vi sử dụng: thẻ được sử dụng trong lãnh thổ Việt Nam",
            "Thẻ trả trước là gì?": "Tương tự như thẻ ghi nợ và thẻ tín dụng, thẻ trả trước cho phép bạn thực hiện thanh toán mà không cần tiền mặt hay séc. Không như thẻ tín dụng, bạn không thanh toán trước, trả sau với thẻ trả trước. Thẻ trả trước cũng không kết nối trực tiếp với tài khoản ngân hàng như thẻ ghi nợ. Thẻ trả trước không có giá trị nào cho đến khi bạn cho tiền vào thẻ.",
            "Làm sao để thay đổi hạn mức thẻ tín dụng": "Thông thường bạn có thể chủ động yêu cầu ngân hàng phát hành thẻ xét duyệt cho bạn một hạn mức tín dụng mới, hoặc đăng ký cho phép ngân hàng xét duyệt tự động giúp bạn. Dựa vào các thói quen khi sử dụng thẻ tín dụng, ngân hàng sẽ cân nhắc việc tăng, hoặc giữ nguyên hạn mức tín dụng hiện tại của bạn\n"
        },
        "raw_text": "Sản phẩm thẻ tín dụng HDBank JCB Ultimate mang sắc màu vương giả và biểu tượng hoa đồng tiền may mắn, được thiết kế tính năng và quyền lợi xứng tầm với phân khúc khách hàng cao cấp, sở hữu và theo đuổi phong thái DẪN ĐẦU. Thẻ tín dụng HDBank JCB Ultimate chính là BIỂU TƯỢNG THÀNH CÔNG, hứa hẹn sẽ mở ra những TRẢI NGHIỆM VÔ HẠN dành cho Quý khách. &nbsp;  Hoàn đến 20% khi chi tiêu tại Nhật Bản. Hoàn đến 15% khi chi tiêu du lịch, khách sạn, resort. Hoàn đến 6% giao dịch quốc tế. Đặc quyền hoàn tiền theo tháng cho thẻ tín dụng HDBank JCB Ultimate  Đặc quyền ưu đãi theo quý: Khách hàng đạt tổng doanh số giao dịch tối thiểu là 100 triệu đồng/quý sẽ nhận được 01 lượt ưu đãi phí chơi Golf/quý, tối đa 4 lượt ưu đãi/năm. Trị giá ưu đãi nhận được tối đa 1.000.000 đồng/lượt (đã bao gồm VAT). Doanh số giao dịch để xét nhận ưu đãi được tính theo quý, không được cộng dồn qua quý tiếp theo.  Bảo hiểm du lịch toàn cầu lên đến 12 tỷ đồng. Xem chi tiết Quy tắc bảo hiểm và Mẫu giấy chứng nhận bảo hiểm  Chủ thẻ được phục vụ theo hotline VIP 1800 6868 của HDBank.  Trả góp lãi suất 0% tại các đối tác liên kết của HDBank.  Đặc quyền ưu đãi từ Tổ chức thẻ JCB   Miễn lãi tối đa 55 ngày  Miễn phí thường niên năm đầu tiên với giá trị đến 2 triệu đồng  Miễn phí thường niên năm đầu tiên dành cho Chủ thẻ phụ An toàn bảo mật với chip EMV, công nghệ xác thực thanh toán 3D-Secure.  Cá nhân từ 18 tuổi trở lên, không bị mất hoặc hạn chế năng lực hành vi dân sự theo quy định của pháp luật. \nTrường hợp đối tượng phát hành thẻ là người nước ngoài thì phải được phép cư trú tại Việt Nam với thời hạn từ 12 tháng trở lên. \nXem chi tiết Điều kiện & Điều khoản: tại đây Xem Tại đây\n \n\tĐề nghị phát hành thẻ tín dụng quốc tế dành cho khách hàng cá nhân: \n\tCMND/ Hộ chiếu/ Căn cước công dân/ Hộ khẩu/ Giấy xác nhận tạm trú. \n\tHợp đồng lao động, Sao kê lương (nếu có). \n\tHồ sơ khác theo yêu cầu cung cấp của đơn vị tiếp nhận xét duyệt hồ sơ tín dụng. \n\n Để tăng hạn mức nhanh chóng thật ra không khó khăn nếu bạn chứng minh được mình là người sở hữu thẻ tín dụng có trách nhiệm. Cụ thể, xuyên suốt quá trình sử dụng thẻ bạn cần:\n\nLuôn thanh toán dư nợ tín dụng đúng hạn.\nTăng thời gian sở hữu thẻ.\nChi tiêu mua sắm thường xuyên. Hạn mức tín dụng là số tiền tối đa mà tổ chức tín dụng cấp cho bạn để bạn có thể sử dụng trên thẻ tín dụng. Mỗi ngân hàng phát hành thẻ sẽ có hạn mức tín dụng tối thiểu và hạn mức tín dụng tối đa khác nhau cho từng loại thẻ riêng biệt. Thậm chí, khi cùng sử dụng một loại thẻ tín dụng, nhưng hạn mức tín dụng cho từng khách hàng cũng khác nhau.\n Thể hiện màu sắc, cá tính riêng thông qua hình ảnh được tự chọn in trên thẻ\nKhông cần mở tài khoản ngân hàng, tạo thẻ nhanh chóng\nQuản lý chi tiêu hiệu quả, xóa tan nỗi lo về lãi suất và hạn mức thanh toán\nMua sắm thỏa thích, thanh toán dễ dàng\nRút tiền mặt tại tất cả máy ATM của HDBank và trong hệ thống thẻ Napas\nPhạm vi sử dụng: thẻ được sử dụng trong lãnh thổ Việt Nam Tương tự như thẻ ghi nợ và thẻ tín dụng, thẻ trả trước cho phép bạn thực hiện thanh toán mà không cần tiền mặt hay séc. Không như thẻ tín dụng, bạn không thanh toán trước, trả sau với thẻ trả trước. Thẻ trả trước cũng không kết nối trực tiếp với tài khoản ngân hàng như thẻ ghi nợ. Thẻ trả trước không có giá trị nào cho đến khi bạn cho tiền vào thẻ. Thông thường bạn có thể chủ động yêu cầu ngân hàng phát hành thẻ xét duyệt cho bạn một hạn mức tín dụng mới, hoặc đăng ký cho phép ngân hàng xét duyệt tự động giúp bạn. Dựa vào các thói quen khi sử dụng thẻ tín dụng, ngân hàng sẽ cân nhắc việc tăng, hoặc giữ nguyên hạn mức tín dụng hiện tại của bạn"
    },
    {
        "metadata": {
            "card_name": "Thẻ trả góp Muadee by HDBank",
            "card_image": "https://cdn.hdbank.com.vn/hdbank-file/product/218x346_1712288860854.png",
            "url": "https://hdbank.com.vn/vi/personal/product/detail/the/the-tin-dung/the-tra-gop-muadee-by-hdbank",
            "card_type": "The Tin Dung",
            "category": "banking_cards",
            "bank": "HDBank",
            "last_updated": "2024-11-29"
        },
        "description": "Thẻ trả góp Muadee by HDBank là giải pháp thanh toán &quot;Mua trước trả sau&quot; trên ứng dụng Muadee by HDBank do ngân hàng HDBank phát triển, cho phép phát hành thẻ trả góp phi vật lý với hạn mức đến 30 triệu đồng sau 5 phút đăng ký online mà không cần chứng minh thu nhập.​",
        "features": {
            "gifts": [
                "Ưu đãi giảm giá đến 200,000đ"
            ],
            "privileges": [
                "Tự động chuyển đổi trả góp từ 3 tháng",
                " ",
                "Giảm đến 200.000đ ",
                "khi trả góp tại Thế Giới Di Động, Điện Máy Xanh, Nguyễn Kim",
                "Không lãi suất, không phí thường niên",
                "trong suốt quá trình sử dụng."
            ],
            "benefits": [
                "Giảm đến 100,000đ khi thanh toán trên Xanh SM, Grab, Be, Shopee Food, Shopee, Ví VNPAY",
                "Giảm đến 200,000đ khi thanh toán tại Thế Giới Di Động, Điện Máy Xanh, Nguyễn Kim, HNam",
                "Giảm đến 200,000đ khi thanh toán tại PNJ",
                "Giảm đến 150,000đ khi thanh toán tại Traveloka",
                " Hạn mức mua sắm đến 30 triệu đồng",
                "Tự động trả góp từ 3 tháng với mọi hóa đơn từ 50k",
                "Không lãi suất, không phí thường niên, không phí tất toán trước hạn",
                "Quản lý đơn hàng và lịch thanh toán dễ dàng ngay trên app Muadee",
                "An toàn bảo mật bởi HDBank",
                "Đăng ký và xét duyệt online trong 5 phút, không cần chứng minh thu nhập với 4 bước đơn giản:"
            ]
        },
        "terms_and_conditions": {
            "conditions": "Cá nhân từ 18 tuổi trở lên, đang sinh sống và làm việc tại Việt Nam.\nCó tài khoản/thẻ ngân hàng (Thẻ ghi nợ)\nCó CCCD",
            "fees": "",
            "documents": "\n\tCCCD\n\n"
        },
        "faqs": {
            "Bí kíp tăng hạn mức tín dụng": "Để tăng hạn mức nhanh chóng thật ra không khó khăn nếu bạn chứng minh được mình là người sở hữu thẻ tín dụng có trách nhiệm. Cụ thể, xuyên suốt quá trình sử dụng thẻ bạn cần:\n\nLuôn thanh toán dư nợ tín dụng đúng hạn.\nTăng thời gian sở hữu thẻ.\nChi tiêu mua sắm thường xuyên.",
            "Hạn mức thẻ tín dụng là gì?": "Hạn mức tín dụng là số tiền tối đa mà tổ chức tín dụng cấp cho bạn để bạn có thể sử dụng trên thẻ tín dụng. Mỗi ngân hàng phát hành thẻ sẽ có hạn mức tín dụng tối thiểu và hạn mức tín dụng tối đa khác nhau cho từng loại thẻ riêng biệt. Thậm chí, khi cùng sử dụng một loại thẻ tín dụng, nhưng hạn mức tín dụng cho từng khách hàng cũng khác nhau.\n",
            "Tính năng của thẻ trả trước?": "Thể hiện màu sắc, cá tính riêng thông qua hình ảnh được tự chọn in trên thẻ\nKhông cần mở tài khoản ngân hàng, tạo thẻ nhanh chóng\nQuản lý chi tiêu hiệu quả, xóa tan nỗi lo về lãi suất và hạn mức thanh toán\nMua sắm thỏa thích, thanh toán dễ dàng\nRút tiền mặt tại tất cả máy ATM của HDBank và trong hệ thống thẻ Napas\nPhạm vi sử dụng: thẻ được sử dụng trong lãnh thổ Việt Nam",
            "Thẻ trả trước là gì?": "Tương tự như thẻ ghi nợ và thẻ tín dụng, thẻ trả trước cho phép bạn thực hiện thanh toán mà không cần tiền mặt hay séc. Không như thẻ tín dụng, bạn không thanh toán trước, trả sau với thẻ trả trước. Thẻ trả trước cũng không kết nối trực tiếp với tài khoản ngân hàng như thẻ ghi nợ. Thẻ trả trước không có giá trị nào cho đến khi bạn cho tiền vào thẻ.",
            "Làm sao để thay đổi hạn mức thẻ tín dụng": "Thông thường bạn có thể chủ động yêu cầu ngân hàng phát hành thẻ xét duyệt cho bạn một hạn mức tín dụng mới, hoặc đăng ký cho phép ngân hàng xét duyệt tự động giúp bạn. Dựa vào các thói quen khi sử dụng thẻ tín dụng, ngân hàng sẽ cân nhắc việc tăng, hoặc giữ nguyên hạn mức tín dụng hiện tại của bạn\n"
        },
        "raw_text": "Thẻ trả góp Muadee by HDBank là giải pháp thanh toán &quot;Mua trước trả sau&quot; trên ứng dụng Muadee by HDBank do ngân hàng HDBank phát triển, cho phép phát hành thẻ trả góp phi vật lý với hạn mức đến 30 triệu đồng sau 5 phút đăng ký online mà không cần chứng minh thu nhập.​ Ưu đãi giảm giá đến 200,000đ Tự động chuyển đổi trả góp từ 3 tháng   Giảm đến 200.000đ  khi trả góp tại Thế Giới Di Động, Điện Máy Xanh, Nguyễn Kim Không lãi suất, không phí thường niên trong suốt quá trình sử dụng. Giảm đến 100,000đ khi thanh toán trên Xanh SM, Grab, Be, Shopee Food, Shopee, Ví VNPAY Giảm đến 200,000đ khi thanh toán tại Thế Giới Di Động, Điện Máy Xanh, Nguyễn Kim, HNam Giảm đến 200,000đ khi thanh toán tại PNJ Giảm đến 150,000đ khi thanh toán tại Traveloka  Hạn mức mua sắm đến 30 triệu đồng Tự động trả góp từ 3 tháng với mọi hóa đơn từ 50k Không lãi suất, không phí thường niên, không phí tất toán trước hạn Quản lý đơn hàng và lịch thanh toán dễ dàng ngay trên app Muadee An toàn bảo mật bởi HDBank Đăng ký và xét duyệt online trong 5 phút, không cần chứng minh thu nhập với 4 bước đơn giản: Cá nhân từ 18 tuổi trở lên, đang sinh sống và làm việc tại Việt Nam.\nCó tài khoản/thẻ ngân hàng (Thẻ ghi nợ)\nCó CCCD  \n\tCCCD\n\n Để tăng hạn mức nhanh chóng thật ra không khó khăn nếu bạn chứng minh được mình là người sở hữu thẻ tín dụng có trách nhiệm. Cụ thể, xuyên suốt quá trình sử dụng thẻ bạn cần:\n\nLuôn thanh toán dư nợ tín dụng đúng hạn.\nTăng thời gian sở hữu thẻ.\nChi tiêu mua sắm thường xuyên. Hạn mức tín dụng là số tiền tối đa mà tổ chức tín dụng cấp cho bạn để bạn có thể sử dụng trên thẻ tín dụng. Mỗi ngân hàng phát hành thẻ sẽ có hạn mức tín dụng tối thiểu và hạn mức tín dụng tối đa khác nhau cho từng loại thẻ riêng biệt. Thậm chí, khi cùng sử dụng một loại thẻ tín dụng, nhưng hạn mức tín dụng cho từng khách hàng cũng khác nhau.\n Thể hiện màu sắc, cá tính riêng thông qua hình ảnh được tự chọn in trên thẻ\nKhông cần mở tài khoản ngân hàng, tạo thẻ nhanh chóng\nQuản lý chi tiêu hiệu quả, xóa tan nỗi lo về lãi suất và hạn mức thanh toán\nMua sắm thỏa thích, thanh toán dễ dàng\nRút tiền mặt tại tất cả máy ATM của HDBank và trong hệ thống thẻ Napas\nPhạm vi sử dụng: thẻ được sử dụng trong lãnh thổ Việt Nam Tương tự như thẻ ghi nợ và thẻ tín dụng, thẻ trả trước cho phép bạn thực hiện thanh toán mà không cần tiền mặt hay séc. Không như thẻ tín dụng, bạn không thanh toán trước, trả sau với thẻ trả trước. Thẻ trả trước cũng không kết nối trực tiếp với tài khoản ngân hàng như thẻ ghi nợ. Thẻ trả trước không có giá trị nào cho đến khi bạn cho tiền vào thẻ. Thông thường bạn có thể chủ động yêu cầu ngân hàng phát hành thẻ xét duyệt cho bạn một hạn mức tín dụng mới, hoặc đăng ký cho phép ngân hàng xét duyệt tự động giúp bạn. Dựa vào các thói quen khi sử dụng thẻ tín dụng, ngân hàng sẽ cân nhắc việc tăng, hoặc giữ nguyên hạn mức tín dụng hiện tại của bạn"
    },
    {
        "metadata": {
            "card_name": "HDBank Best Friend Forever",
            "card_image": "https://cdn.hdbank.com.vn/hdbank-file/product/BFF_new.jpg",
            "url": "https://hdbank.com.vn/vi/personal/product/detail/the/the-tin-dung/hdbank-best-friend-forever",
            "card_type": "The Tin Dung",
            "category": "banking_cards",
            "bank": "HDBank",
            "last_updated": "2024-11-29"
        },
        "description": "HDBank hỗ trợ sinh viên mở thẻ tín dụng dành cho HSSV (Best Friend Forever) nhanh chóng chỉ với vài thao tác đơn giản. Với hạn mức đến 10 triệu đồng cùng nhiều ưu đãi hấp dẫn.",
        "features": {
            "gifts": [
                "Hoàn phí thường niên năm đầu (Điều khoản điều kiện theo quy định của HDBank tai day)"
            ],
            "privileges": [
                "Tích điểm SkyJoy không giới hạn.",
                " ",
                "Thanh toán tối thiểu chỉ 1% ",
                "trên doanh số giao dịch.",
                "Trả góp 0% lãi suất",
                "tại các đối tác liên kết HDBank."
            ],
            "benefits": [
                "Tích 1 điểm thưởng Skyjoy cho mỗi 100.000 đồng doanh thu giao dịch nội địa.",
                "Tích 5 điểm thưởng Skyjoy  cho mỗi 100.000 đồng doanh thu giao dịch quốc tế.",
                "Cho phép giao dịch, thanh toán trực tuyến và tại các cửa hàng có chấp nhận thẻ.",
                "Tận hưởng đến 50% ưu đãi từ “Happy Zone” như di chuyển, ẩm thực, du lịch, học tập, giải trí,...",
                "Trả góp lãi suất 0% điện thoại, điện máy, mua sắm, trang sức, du lịch,...",
                "Dễ dàng quản lý và kiểm soát chi tiêu với bảng sao kê giao dịch hàng tháng và dịch vụ SMS Banking.",
                "7 cách thanh toán dư nợ dễ dàng, thuận tiện.",
                " Được sự trợ giúp mọi lúc mọi nơi 24/ 7 với Hotline 1900 6060",
                "Hạn mức đến 10 triệu đồng.",
                "Thanh toán tối thiểu chỉ 1% trên doanh số giao dịch.",
                "Miễn lãi tối đa 45 ngày.",
                "An toàn bảo mật với chip EMV, công nghệ xác thực thanh toán 3D – Secure."
            ]
        },
        "terms_and_conditions": {
            "conditions": "- Cá nhân từ 18 tuổi trở lên, không bị mất hoặc hạn chế năng lực hành vi dân sự theo quy định của pháp luật.\n- Trường hợp đối tượng phát hành thẻ là người nước ngoài thì phải được phép cư trú tại Việt Nam với thời hạn từ 12 tháng trở lên\n- Xem chi tiết Điều kiện & Điều khoản: tại đây",
            "fees": "- Hạn mức thẻ: Từ 2 - 10 triệu đồng\n- Phí phát hành: Miễn phí\n- Phí thường niên: 144.000 đồng/ năm (Hoàn phí năm đầu*)\n- Lãi suất (%/ năm): 28%\n- Tỷ lệ thanh toán tối thiểu: 1%\n- Phí chuyển đổi ngoại tệ: 3%\n- Thời gian miễn lãi tối đa: 45 ngày​\n- Chi tiết Xem tại đây\n",
            "documents": "- CMND/ Hộ chiếu/ Căn cước công dân/ Hộ khẩu/ Giấy xác nhận tạm trú.\n- Thẻ học sinh sinh viên/ Giấy chứng nhận của trường (Bản chính)/ Thẻ BHYT có mã số HS/SV.\n- Bảng điểm do trường xác nhận (bản chính)/ Hình chụp thông tin từ website của trường/ sổ liên lạc hoặc chứng từ khác của trường thể hiện điểm số...\n- Hồ sơ khác.\n"
        },
        "faqs": {
            "Bí kíp tăng hạn mức tín dụng": "Để tăng hạn mức nhanh chóng thật ra không khó khăn nếu bạn chứng minh được mình là người sở hữu thẻ tín dụng có trách nhiệm. Cụ thể, xuyên suốt quá trình sử dụng thẻ bạn cần:\n\nLuôn thanh toán dư nợ tín dụng đúng hạn.\nTăng thời gian sở hữu thẻ.\nChi tiêu mua sắm thường xuyên.",
            "Hạn mức thẻ tín dụng là gì?": "Hạn mức tín dụng là số tiền tối đa mà tổ chức tín dụng cấp cho bạn để bạn có thể sử dụng trên thẻ tín dụng. Mỗi ngân hàng phát hành thẻ sẽ có hạn mức tín dụng tối thiểu và hạn mức tín dụng tối đa khác nhau cho từng loại thẻ riêng biệt. Thậm chí, khi cùng sử dụng một loại thẻ tín dụng, nhưng hạn mức tín dụng cho từng khách hàng cũng khác nhau.\n",
            "Tính năng của thẻ trả trước?": "Thể hiện màu sắc, cá tính riêng thông qua hình ảnh được tự chọn in trên thẻ\nKhông cần mở tài khoản ngân hàng, tạo thẻ nhanh chóng\nQuản lý chi tiêu hiệu quả, xóa tan nỗi lo về lãi suất và hạn mức thanh toán\nMua sắm thỏa thích, thanh toán dễ dàng\nRút tiền mặt tại tất cả máy ATM của HDBank và trong hệ thống thẻ Napas\nPhạm vi sử dụng: thẻ được sử dụng trong lãnh thổ Việt Nam",
            "Thẻ trả trước là gì?": "Tương tự như thẻ ghi nợ và thẻ tín dụng, thẻ trả trước cho phép bạn thực hiện thanh toán mà không cần tiền mặt hay séc. Không như thẻ tín dụng, bạn không thanh toán trước, trả sau với thẻ trả trước. Thẻ trả trước cũng không kết nối trực tiếp với tài khoản ngân hàng như thẻ ghi nợ. Thẻ trả trước không có giá trị nào cho đến khi bạn cho tiền vào thẻ.",
            "Làm sao để thay đổi hạn mức thẻ tín dụng": "Thông thường bạn có thể chủ động yêu cầu ngân hàng phát hành thẻ xét duyệt cho bạn một hạn mức tín dụng mới, hoặc đăng ký cho phép ngân hàng xét duyệt tự động giúp bạn. Dựa vào các thói quen khi sử dụng thẻ tín dụng, ngân hàng sẽ cân nhắc việc tăng, hoặc giữ nguyên hạn mức tín dụng hiện tại của bạn\n"
        },
        "raw_text": "HDBank hỗ trợ sinh viên mở thẻ tín dụng dành cho HSSV (Best Friend Forever) nhanh chóng chỉ với vài thao tác đơn giản. Với hạn mức đến 10 triệu đồng cùng nhiều ưu đãi hấp dẫn. Hoàn phí thường niên năm đầu (Điều khoản điều kiện theo quy định của HDBank tai day) Tích điểm SkyJoy không giới hạn.   Thanh toán tối thiểu chỉ 1%  trên doanh số giao dịch. Trả góp 0% lãi suất tại các đối tác liên kết HDBank. Tích 1 điểm thưởng Skyjoy cho mỗi 100.000 đồng doanh thu giao dịch nội địa. Tích 5 điểm thưởng Skyjoy  cho mỗi 100.000 đồng doanh thu giao dịch quốc tế. Cho phép giao dịch, thanh toán trực tuyến và tại các cửa hàng có chấp nhận thẻ. Tận hưởng đến 50% ưu đãi từ “Happy Zone” như di chuyển, ẩm thực, du lịch, học tập, giải trí,... Trả góp lãi suất 0% điện thoại, điện máy, mua sắm, trang sức, du lịch,... Dễ dàng quản lý và kiểm soát chi tiêu với bảng sao kê giao dịch hàng tháng và dịch vụ SMS Banking. 7 cách thanh toán dư nợ dễ dàng, thuận tiện.  Được sự trợ giúp mọi lúc mọi nơi 24/ 7 với Hotline 1900 6060 Hạn mức đến 10 triệu đồng. Thanh toán tối thiểu chỉ 1% trên doanh số giao dịch. Miễn lãi tối đa 45 ngày. An toàn bảo mật với chip EMV, công nghệ xác thực thanh toán 3D – Secure. - Cá nhân từ 18 tuổi trở lên, không bị mất hoặc hạn chế năng lực hành vi dân sự theo quy định của pháp luật.\n- Trường hợp đối tượng phát hành thẻ là người nước ngoài thì phải được phép cư trú tại Việt Nam với thời hạn từ 12 tháng trở lên\n- Xem chi tiết Điều kiện & Điều khoản: tại đây - Hạn mức thẻ: Từ 2 - 10 triệu đồng\n- Phí phát hành: Miễn phí\n- Phí thường niên: 144.000 đồng/ năm (Hoàn phí năm đầu*)\n- Lãi suất (%/ năm): 28%\n- Tỷ lệ thanh toán tối thiểu: 1%\n- Phí chuyển đổi ngoại tệ: 3%\n- Thời gian miễn lãi tối đa: 45 ngày​\n- Chi tiết Xem tại đây\n - CMND/ Hộ chiếu/ Căn cước công dân/ Hộ khẩu/ Giấy xác nhận tạm trú.\n- Thẻ học sinh sinh viên/ Giấy chứng nhận của trường (Bản chính)/ Thẻ BHYT có mã số HS/SV.\n- Bảng điểm do trường xác nhận (bản chính)/ Hình chụp thông tin từ website của trường/ sổ liên lạc hoặc chứng từ khác của trường thể hiện điểm số...\n- Hồ sơ khác.\n Để tăng hạn mức nhanh chóng thật ra không khó khăn nếu bạn chứng minh được mình là người sở hữu thẻ tín dụng có trách nhiệm. Cụ thể, xuyên suốt quá trình sử dụng thẻ bạn cần:\n\nLuôn thanh toán dư nợ tín dụng đúng hạn.\nTăng thời gian sở hữu thẻ.\nChi tiêu mua sắm thường xuyên. Hạn mức tín dụng là số tiền tối đa mà tổ chức tín dụng cấp cho bạn để bạn có thể sử dụng trên thẻ tín dụng. Mỗi ngân hàng phát hành thẻ sẽ có hạn mức tín dụng tối thiểu và hạn mức tín dụng tối đa khác nhau cho từng loại thẻ riêng biệt. Thậm chí, khi cùng sử dụng một loại thẻ tín dụng, nhưng hạn mức tín dụng cho từng khách hàng cũng khác nhau.\n Thể hiện màu sắc, cá tính riêng thông qua hình ảnh được tự chọn in trên thẻ\nKhông cần mở tài khoản ngân hàng, tạo thẻ nhanh chóng\nQuản lý chi tiêu hiệu quả, xóa tan nỗi lo về lãi suất và hạn mức thanh toán\nMua sắm thỏa thích, thanh toán dễ dàng\nRút tiền mặt tại tất cả máy ATM của HDBank và trong hệ thống thẻ Napas\nPhạm vi sử dụng: thẻ được sử dụng trong lãnh thổ Việt Nam Tương tự như thẻ ghi nợ và thẻ tín dụng, thẻ trả trước cho phép bạn thực hiện thanh toán mà không cần tiền mặt hay séc. Không như thẻ tín dụng, bạn không thanh toán trước, trả sau với thẻ trả trước. Thẻ trả trước cũng không kết nối trực tiếp với tài khoản ngân hàng như thẻ ghi nợ. Thẻ trả trước không có giá trị nào cho đến khi bạn cho tiền vào thẻ. Thông thường bạn có thể chủ động yêu cầu ngân hàng phát hành thẻ xét duyệt cho bạn một hạn mức tín dụng mới, hoặc đăng ký cho phép ngân hàng xét duyệt tự động giúp bạn. Dựa vào các thói quen khi sử dụng thẻ tín dụng, ngân hàng sẽ cân nhắc việc tăng, hoặc giữ nguyên hạn mức tín dụng hiện tại của bạn"
    },
    {
        "metadata": {
            "card_name": "HDBank Visa Gold",
            "card_image": "https://cdn.hdbank.com.vn/hdbank-file/product/VS_Gold_new.jpg",
            "url": "https://hdbank.com.vn/vi/personal/product/detail/the/the-tin-dung/hdbank-visa-gold",
            "card_type": "The Tin Dung",
            "category": "banking_cards",
            "bank": "HDBank",
            "last_updated": "2024-11-29"
        },
        "description": "Sở hữu ngay chiếc Thẻ HDBank Visa Gold quý khách sẽ được hoàn phí thường niên năm đầu tiên, tặng 2 thẻ phụ cho người thân​",
        "features": {
            "gifts": [
                "Hoàn phí thường niên năm đầu (Điều khoản điều kiện theo quy định của HDBank)"
            ],
            "privileges": [
                "Tích điểm SkyJoy không giới hạn",
                " ",
                "Trả góp 0% lãi suất",
                "tại các đối tác liên kết HDBank.",
                "Hoàn phí thường niên năm đầu*",
                " "
            ],
            "benefits": [
                "Tích 2 điểm thưởng SkyJoy cho mỗi 100.000 đồng doanh thu giao dịch nội địa",
                "Tích 3 điểm thưởng SkyJoy cho mỗi 100.000 đồng doanh thu giao dịch quốc tế",
                "Dễ dàng quản lý và kiểm soát mọi chi tiêu thông qua bảng sao kê giao dịch hàng tháng và dịch vụ SMS Banking.",
                "Thanh toán dư nợ dễ dàng, không cần đến Ngân hàng với dịch vụ thanh toán tự động thẻ tín dụng của Ngân hàng hoặc chuyển khoản thanh toán tại ATM HDBank hoặc chuyển khoản thanh toán từ ngân hàng khác.",
                "Tận hưởng các ưu đãi, chiết khấu thanh toán từ “Happy Zone” của HDBank và tổ chức thẻ Visa.",
                "Hạn mức từ 10 triệu đồng trở lên.",
                "Miễn lãi tối đa 45 ngày.",
                "Hoàn phí thường niên năm đầu tiên dành cho Chủ thẻ phụ (Điều khoản điều kiện theo quy định của HDBank)",
                "An toàn bảo mật với chip EMV, công nghệ xác thực thanh toán 3D - Secure."
            ]
        },
        "terms_and_conditions": {
            "conditions": "- Cá nhân từ 18 tuổi trở lên, không bị mất hoặc hạn chế năng lực hành vi dân sự theo quy định của pháp luật.\n- Trường hợp đối tượng phát hành thẻ là người nước ngoài thì phải được phép cư trú tại Việt Nam với thời hạn từ 12 tháng trở lên\n- Xem chi tiết Điều kiện & Điều khoản: tại đây",
            "fees": "- Hạn mức thẻ: Từ 10 triệu đồng\n- Phí phát hành: Miễn phí\n- Phí thường niên:\n+ 440.000 đồng/ năm (Hoàn phí năm đầu*)\n+ Hoàn phí thường niên năm đầu tiên dành cho Chủ thẻ phụ*\n\n*Điều khoản điều kiện theo quy định của HDBank\n- Lãi suất (%/ năm): 33%\n- Tỷ lệ thanh toán tối thiểu: 3%\n- Phí chuyển đổi ngoại tệ: 3%\n- Thời gian miễn lãi tối đa: 45 ngày​\n- Chi tiết Xem tại đây\n",
            "documents": "- CMND/ Hộ chiếu/ Căn cước công dân/ Hộ khẩu/ Giấy xác nhận tạm trú.\n- Hợp đồng lao động Sao kê lương (nếu có).\n- Hồ sơ khác\n"
        },
        "faqs": {
            "Bí kíp tăng hạn mức tín dụng": "Để tăng hạn mức nhanh chóng thật ra không khó khăn nếu bạn chứng minh được mình là người sở hữu thẻ tín dụng có trách nhiệm. Cụ thể, xuyên suốt quá trình sử dụng thẻ bạn cần:\n\nLuôn thanh toán dư nợ tín dụng đúng hạn.\nTăng thời gian sở hữu thẻ.\nChi tiêu mua sắm thường xuyên.",
            "Hạn mức thẻ tín dụng là gì?": "Hạn mức tín dụng là số tiền tối đa mà tổ chức tín dụng cấp cho bạn để bạn có thể sử dụng trên thẻ tín dụng. Mỗi ngân hàng phát hành thẻ sẽ có hạn mức tín dụng tối thiểu và hạn mức tín dụng tối đa khác nhau cho từng loại thẻ riêng biệt. Thậm chí, khi cùng sử dụng một loại thẻ tín dụng, nhưng hạn mức tín dụng cho từng khách hàng cũng khác nhau.\n",
            "Tính năng của thẻ trả trước?": "Thể hiện màu sắc, cá tính riêng thông qua hình ảnh được tự chọn in trên thẻ\nKhông cần mở tài khoản ngân hàng, tạo thẻ nhanh chóng\nQuản lý chi tiêu hiệu quả, xóa tan nỗi lo về lãi suất và hạn mức thanh toán\nMua sắm thỏa thích, thanh toán dễ dàng\nRút tiền mặt tại tất cả máy ATM của HDBank và trong hệ thống thẻ Napas\nPhạm vi sử dụng: thẻ được sử dụng trong lãnh thổ Việt Nam",
            "Thẻ trả trước là gì?": "Tương tự như thẻ ghi nợ và thẻ tín dụng, thẻ trả trước cho phép bạn thực hiện thanh toán mà không cần tiền mặt hay séc. Không như thẻ tín dụng, bạn không thanh toán trước, trả sau với thẻ trả trước. Thẻ trả trước cũng không kết nối trực tiếp với tài khoản ngân hàng như thẻ ghi nợ. Thẻ trả trước không có giá trị nào cho đến khi bạn cho tiền vào thẻ.",
            "Làm sao để thay đổi hạn mức thẻ tín dụng": "Thông thường bạn có thể chủ động yêu cầu ngân hàng phát hành thẻ xét duyệt cho bạn một hạn mức tín dụng mới, hoặc đăng ký cho phép ngân hàng xét duyệt tự động giúp bạn. Dựa vào các thói quen khi sử dụng thẻ tín dụng, ngân hàng sẽ cân nhắc việc tăng, hoặc giữ nguyên hạn mức tín dụng hiện tại của bạn\n"
        },
        "raw_text": "Sở hữu ngay chiếc Thẻ HDBank Visa Gold quý khách sẽ được hoàn phí thường niên năm đầu tiên, tặng 2 thẻ phụ cho người thân​ Hoàn phí thường niên năm đầu (Điều khoản điều kiện theo quy định của HDBank) Tích điểm SkyJoy không giới hạn   Trả góp 0% lãi suất tại các đối tác liên kết HDBank. Hoàn phí thường niên năm đầu*   Tích 2 điểm thưởng SkyJoy cho mỗi 100.000 đồng doanh thu giao dịch nội địa Tích 3 điểm thưởng SkyJoy cho mỗi 100.000 đồng doanh thu giao dịch quốc tế Dễ dàng quản lý và kiểm soát mọi chi tiêu thông qua bảng sao kê giao dịch hàng tháng và dịch vụ SMS Banking. Thanh toán dư nợ dễ dàng, không cần đến Ngân hàng với dịch vụ thanh toán tự động thẻ tín dụng của Ngân hàng hoặc chuyển khoản thanh toán tại ATM HDBank hoặc chuyển khoản thanh toán từ ngân hàng khác. Tận hưởng các ưu đãi, chiết khấu thanh toán từ “Happy Zone” của HDBank và tổ chức thẻ Visa. Hạn mức từ 10 triệu đồng trở lên. Miễn lãi tối đa 45 ngày. Hoàn phí thường niên năm đầu tiên dành cho Chủ thẻ phụ (Điều khoản điều kiện theo quy định của HDBank) An toàn bảo mật với chip EMV, công nghệ xác thực thanh toán 3D - Secure. - Cá nhân từ 18 tuổi trở lên, không bị mất hoặc hạn chế năng lực hành vi dân sự theo quy định của pháp luật.\n- Trường hợp đối tượng phát hành thẻ là người nước ngoài thì phải được phép cư trú tại Việt Nam với thời hạn từ 12 tháng trở lên\n- Xem chi tiết Điều kiện & Điều khoản: tại đây - Hạn mức thẻ: Từ 10 triệu đồng\n- Phí phát hành: Miễn phí\n- Phí thường niên:\n+ 440.000 đồng/ năm (Hoàn phí năm đầu*)\n+ Hoàn phí thường niên năm đầu tiên dành cho Chủ thẻ phụ*\n\n*Điều khoản điều kiện theo quy định của HDBank\n- Lãi suất (%/ năm): 33%\n- Tỷ lệ thanh toán tối thiểu: 3%\n- Phí chuyển đổi ngoại tệ: 3%\n- Thời gian miễn lãi tối đa: 45 ngày​\n- Chi tiết Xem tại đây\n - CMND/ Hộ chiếu/ Căn cước công dân/ Hộ khẩu/ Giấy xác nhận tạm trú.\n- Hợp đồng lao động Sao kê lương (nếu có).\n- Hồ sơ khác\n Để tăng hạn mức nhanh chóng thật ra không khó khăn nếu bạn chứng minh được mình là người sở hữu thẻ tín dụng có trách nhiệm. Cụ thể, xuyên suốt quá trình sử dụng thẻ bạn cần:\n\nLuôn thanh toán dư nợ tín dụng đúng hạn.\nTăng thời gian sở hữu thẻ.\nChi tiêu mua sắm thường xuyên. Hạn mức tín dụng là số tiền tối đa mà tổ chức tín dụng cấp cho bạn để bạn có thể sử dụng trên thẻ tín dụng. Mỗi ngân hàng phát hành thẻ sẽ có hạn mức tín dụng tối thiểu và hạn mức tín dụng tối đa khác nhau cho từng loại thẻ riêng biệt. Thậm chí, khi cùng sử dụng một loại thẻ tín dụng, nhưng hạn mức tín dụng cho từng khách hàng cũng khác nhau.\n Thể hiện màu sắc, cá tính riêng thông qua hình ảnh được tự chọn in trên thẻ\nKhông cần mở tài khoản ngân hàng, tạo thẻ nhanh chóng\nQuản lý chi tiêu hiệu quả, xóa tan nỗi lo về lãi suất và hạn mức thanh toán\nMua sắm thỏa thích, thanh toán dễ dàng\nRút tiền mặt tại tất cả máy ATM của HDBank và trong hệ thống thẻ Napas\nPhạm vi sử dụng: thẻ được sử dụng trong lãnh thổ Việt Nam Tương tự như thẻ ghi nợ và thẻ tín dụng, thẻ trả trước cho phép bạn thực hiện thanh toán mà không cần tiền mặt hay séc. Không như thẻ tín dụng, bạn không thanh toán trước, trả sau với thẻ trả trước. Thẻ trả trước cũng không kết nối trực tiếp với tài khoản ngân hàng như thẻ ghi nợ. Thẻ trả trước không có giá trị nào cho đến khi bạn cho tiền vào thẻ. Thông thường bạn có thể chủ động yêu cầu ngân hàng phát hành thẻ xét duyệt cho bạn một hạn mức tín dụng mới, hoặc đăng ký cho phép ngân hàng xét duyệt tự động giúp bạn. Dựa vào các thói quen khi sử dụng thẻ tín dụng, ngân hàng sẽ cân nhắc việc tăng, hoặc giữ nguyên hạn mức tín dụng hiện tại của bạn"
    },
    {
        "metadata": {
            "card_name": "HDBank Visa Classic",
            "card_image": "https://cdn.hdbank.com.vn/hdbank-file/product/VS_classic_new.jpg",
            "url": "https://hdbank.com.vn/vi/personal/product/detail/the/the-tin-dung/hdbank-visa-classic",
            "card_type": "The Tin Dung",
            "category": "banking_cards",
            "bank": "HDBank",
            "last_updated": "2024-11-29"
        },
        "description": "Thẻ tín dụng quốc tế HDBank là phương tiện thanh toán thay thế tiền mặt với chức năng: Chi tiêu trước &ndash; trả tiền sau.Được miễn lãi tối đa lên đến 45 ngày. An toàn và thuận tiện trong mọi giao dịch thanh toán trên toàn thế giới.",
        "features": {
            "gifts": [
                "Miễn phí thường niên năm đầu"
            ],
            "privileges": [
                "Tích điểm SkyJoy không giới hạn",
                " ",
                "Trả góp 0% lãi suất",
                "Mitại các đối tác liên kết HDBank.",
                "Miễn phí thường niên năm đầu",
                " "
            ],
            "benefits": [
                "Tích 1 điểm thưởng SkyJoy cho mỗi 100.000 đồng doanh thu giao dịch nội địa.",
                "Tích 5 điểm thưởng SkyJoy cho mỗi 100.000 đồng doanh thu giao dịch quốc tế.",
                "Dễ dàng quản lý và kiểm soát mọi chi tiêu thông qua bảng sao kê giao dịch hàng tháng và dịch vụ SMS Banking.",
                "Là công cụ hỗ trợ tài chính kịp thời và hiệu quả khi đi công tác, du lịch và du học hoặc khi đột xuất/  khó khăn.",
                "Thanh toán dư nợ dễ dàng, không cần đến Ngân hàng với dịch vụ thanh toán tự động thẻ tín dụng của Ngân hàng hoặc chuyển khoản thanh toán tại ATM HDBank hoặc chuyển khoản thanh toán từ ngân hàng khác.",
                "Tận hưởng các ưu đãi, chiết khấu thanh toán từ “Happy Zone” của HDBank và tổ chức thẻ Visa.",
                "Trả góp lãi suất 0% tại các đối tác liên kết của HDBank.",
                "Hoàn phí thường niên năm đầu tiên dành cho Chủ thẻ phụ *",
                "Miễn lãi tối đa 45 ngày.",
                "An toàn bảo mật với chip EMV, công nghệ xác thực thanh toán 3D – Secure."
            ]
        },
        "terms_and_conditions": {
            "conditions": "- Cá nhân từ 18 tuổi trở lên, không bị mất hoặc hạn chế năng lực hành vi dân sự theo quy định của pháp luật.\n- Trường hợp đối tượng phát hành thẻ là người nước ngoài thì phải được phép cư trú tại Việt Nam với thời hạn từ 12 tháng trở lên\n- Xem chi tiết Điều kiện & Điều khoản: tại đây",
            "fees": "- Hạn mức thẻ: Đến 50 triệu đồng\n- Phí phát hành: Miễn phí\n- Phí thường niên: 220.000 đồng/ năm (miễn phí năm đầu)\n- Lãi suất (%/ năm): 36%\n- Tỷ lệ thanh toán tối thiểu: 3%\n- Phí chuyển đổi ngoại tệ: 3%\n- Thời gian miễn lãi tối đa: 45 ngày​\n- Chi tiết Xem tại đây\n",
            "documents": "- CMND/ Hộ chiếu/ Căn cước công dân/ Hộ khẩu/ Giấy xác nhận tạm trú.\n- Hợp đồng lao động Sao kê lương (nếu có).\n- Hồ sơ khác\n"
        },
        "faqs": {
            "Bí kíp tăng hạn mức tín dụng": "Để tăng hạn mức nhanh chóng thật ra không khó khăn nếu bạn chứng minh được mình là người sở hữu thẻ tín dụng có trách nhiệm. Cụ thể, xuyên suốt quá trình sử dụng thẻ bạn cần:\n\nLuôn thanh toán dư nợ tín dụng đúng hạn.\nTăng thời gian sở hữu thẻ.\nChi tiêu mua sắm thường xuyên.",
            "Hạn mức thẻ tín dụng là gì?": "Hạn mức tín dụng là số tiền tối đa mà tổ chức tín dụng cấp cho bạn để bạn có thể sử dụng trên thẻ tín dụng. Mỗi ngân hàng phát hành thẻ sẽ có hạn mức tín dụng tối thiểu và hạn mức tín dụng tối đa khác nhau cho từng loại thẻ riêng biệt. Thậm chí, khi cùng sử dụng một loại thẻ tín dụng, nhưng hạn mức tín dụng cho từng khách hàng cũng khác nhau.\n",
            "Tính năng của thẻ trả trước?": "Thể hiện màu sắc, cá tính riêng thông qua hình ảnh được tự chọn in trên thẻ\nKhông cần mở tài khoản ngân hàng, tạo thẻ nhanh chóng\nQuản lý chi tiêu hiệu quả, xóa tan nỗi lo về lãi suất và hạn mức thanh toán\nMua sắm thỏa thích, thanh toán dễ dàng\nRút tiền mặt tại tất cả máy ATM của HDBank và trong hệ thống thẻ Napas\nPhạm vi sử dụng: thẻ được sử dụng trong lãnh thổ Việt Nam",
            "Thẻ trả trước là gì?": "Tương tự như thẻ ghi nợ và thẻ tín dụng, thẻ trả trước cho phép bạn thực hiện thanh toán mà không cần tiền mặt hay séc. Không như thẻ tín dụng, bạn không thanh toán trước, trả sau với thẻ trả trước. Thẻ trả trước cũng không kết nối trực tiếp với tài khoản ngân hàng như thẻ ghi nợ. Thẻ trả trước không có giá trị nào cho đến khi bạn cho tiền vào thẻ.",
            "Làm sao để thay đổi hạn mức thẻ tín dụng": "Thông thường bạn có thể chủ động yêu cầu ngân hàng phát hành thẻ xét duyệt cho bạn một hạn mức tín dụng mới, hoặc đăng ký cho phép ngân hàng xét duyệt tự động giúp bạn. Dựa vào các thói quen khi sử dụng thẻ tín dụng, ngân hàng sẽ cân nhắc việc tăng, hoặc giữ nguyên hạn mức tín dụng hiện tại của bạn\n"
        },
        "raw_text": "Thẻ tín dụng quốc tế HDBank là phương tiện thanh toán thay thế tiền mặt với chức năng: Chi tiêu trước &ndash; trả tiền sau.Được miễn lãi tối đa lên đến 45 ngày. An toàn và thuận tiện trong mọi giao dịch thanh toán trên toàn thế giới. Miễn phí thường niên năm đầu Tích điểm SkyJoy không giới hạn   Trả góp 0% lãi suất Mitại các đối tác liên kết HDBank. Miễn phí thường niên năm đầu   Tích 1 điểm thưởng SkyJoy cho mỗi 100.000 đồng doanh thu giao dịch nội địa. Tích 5 điểm thưởng SkyJoy cho mỗi 100.000 đồng doanh thu giao dịch quốc tế. Dễ dàng quản lý và kiểm soát mọi chi tiêu thông qua bảng sao kê giao dịch hàng tháng và dịch vụ SMS Banking. Là công cụ hỗ trợ tài chính kịp thời và hiệu quả khi đi công tác, du lịch và du học hoặc khi đột xuất/  khó khăn. Thanh toán dư nợ dễ dàng, không cần đến Ngân hàng với dịch vụ thanh toán tự động thẻ tín dụng của Ngân hàng hoặc chuyển khoản thanh toán tại ATM HDBank hoặc chuyển khoản thanh toán từ ngân hàng khác. Tận hưởng các ưu đãi, chiết khấu thanh toán từ “Happy Zone” của HDBank và tổ chức thẻ Visa. Trả góp lãi suất 0% tại các đối tác liên kết của HDBank. Hoàn phí thường niên năm đầu tiên dành cho Chủ thẻ phụ * Miễn lãi tối đa 45 ngày. An toàn bảo mật với chip EMV, công nghệ xác thực thanh toán 3D – Secure. - Cá nhân từ 18 tuổi trở lên, không bị mất hoặc hạn chế năng lực hành vi dân sự theo quy định của pháp luật.\n- Trường hợp đối tượng phát hành thẻ là người nước ngoài thì phải được phép cư trú tại Việt Nam với thời hạn từ 12 tháng trở lên\n- Xem chi tiết Điều kiện & Điều khoản: tại đây - Hạn mức thẻ: Đến 50 triệu đồng\n- Phí phát hành: Miễn phí\n- Phí thường niên: 220.000 đồng/ năm (miễn phí năm đầu)\n- Lãi suất (%/ năm): 36%\n- Tỷ lệ thanh toán tối thiểu: 3%\n- Phí chuyển đổi ngoại tệ: 3%\n- Thời gian miễn lãi tối đa: 45 ngày​\n- Chi tiết Xem tại đây\n - CMND/ Hộ chiếu/ Căn cước công dân/ Hộ khẩu/ Giấy xác nhận tạm trú.\n- Hợp đồng lao động Sao kê lương (nếu có).\n- Hồ sơ khác\n Để tăng hạn mức nhanh chóng thật ra không khó khăn nếu bạn chứng minh được mình là người sở hữu thẻ tín dụng có trách nhiệm. Cụ thể, xuyên suốt quá trình sử dụng thẻ bạn cần:\n\nLuôn thanh toán dư nợ tín dụng đúng hạn.\nTăng thời gian sở hữu thẻ.\nChi tiêu mua sắm thường xuyên. Hạn mức tín dụng là số tiền tối đa mà tổ chức tín dụng cấp cho bạn để bạn có thể sử dụng trên thẻ tín dụng. Mỗi ngân hàng phát hành thẻ sẽ có hạn mức tín dụng tối thiểu và hạn mức tín dụng tối đa khác nhau cho từng loại thẻ riêng biệt. Thậm chí, khi cùng sử dụng một loại thẻ tín dụng, nhưng hạn mức tín dụng cho từng khách hàng cũng khác nhau.\n Thể hiện màu sắc, cá tính riêng thông qua hình ảnh được tự chọn in trên thẻ\nKhông cần mở tài khoản ngân hàng, tạo thẻ nhanh chóng\nQuản lý chi tiêu hiệu quả, xóa tan nỗi lo về lãi suất và hạn mức thanh toán\nMua sắm thỏa thích, thanh toán dễ dàng\nRút tiền mặt tại tất cả máy ATM của HDBank và trong hệ thống thẻ Napas\nPhạm vi sử dụng: thẻ được sử dụng trong lãnh thổ Việt Nam Tương tự như thẻ ghi nợ và thẻ tín dụng, thẻ trả trước cho phép bạn thực hiện thanh toán mà không cần tiền mặt hay séc. Không như thẻ tín dụng, bạn không thanh toán trước, trả sau với thẻ trả trước. Thẻ trả trước cũng không kết nối trực tiếp với tài khoản ngân hàng như thẻ ghi nợ. Thẻ trả trước không có giá trị nào cho đến khi bạn cho tiền vào thẻ. Thông thường bạn có thể chủ động yêu cầu ngân hàng phát hành thẻ xét duyệt cho bạn một hạn mức tín dụng mới, hoặc đăng ký cho phép ngân hàng xét duyệt tự động giúp bạn. Dựa vào các thói quen khi sử dụng thẻ tín dụng, ngân hàng sẽ cân nhắc việc tăng, hoặc giữ nguyên hạn mức tín dụng hiện tại của bạn"
    },
    {
        "metadata": {
            "card_name": "HDBank Mastercard Gold",
            "card_image": "https://cdn.hdbank.com.vn/hdbank-file/product/MC_Credit_new.jpg",
            "url": "https://hdbank.com.vn/vi/personal/product/detail/the/the-tin-dung/hdbank-mastercard-gold",
            "card_type": "The Tin Dung",
            "category": "banking_cards",
            "bank": "HDBank",
            "last_updated": "2024-11-29"
        },
        "description": "HDBank Mastercard Gold với Công nghệ mới Contactless cho phép thanh toán tại hàng triệu điểm chấp nhận thẻ,&nbsp; An toàn và thuận tiện trong mọi giao dịch thanh toán trên toàn thế giới.",
        "features": {
            "gifts": [
                "Miễn phí thường niên năm đầu"
            ],
            "privileges": [
                "Tích điểm SkyJoy không giới hạn",
                " ",
                "Trả góp 0% lãi suất",
                "tại các đối tác liên kết HDBank.",
                "Miễn phí thường niên năm đầu",
                " "
            ],
            "benefits": [
                "Tích 1 điểm thưởng SkyJoy cho mỗi 100.000 đồng doanh thu giao dịch nội địa.",
                "Tích 5 điểm thưởng SkyJoy cho mỗi 100.000 đồng doanh thu giao dịch quốc tế.",
                "Tận hưởng vô vàn các ưu đãi, chiết khấu thanh toán từ “Happy Zone” của HDBank và tổ chức thẻ MasterCard.",
                "Dễ dàng quản lý và kiểm soát mọi chi tiêu thông qua bảng sao kê giao dịch hàng tháng và dịch vụ SMS Banking.",
                "Thanh toán dư nợ dễ dàng, không cần đến Ngân hàng với dịch vụ thanh toán tự động thẻ tín dụng của Ngân hàng hoặc chuyển khoản thanh toán tại ATM HDBank hoặc chuyển khoản thanh toán từ ngân hàng khác.",
                "Trả góp lãi suất 0% tại các đối tác liên kết của HDBank.",
                "Hoàn phí thường niên năm đầu tiên dành cho Chủ thẻ phụ *",
                "Miễn lãi tối đa 45 ngày.",
                "An toàn bảo mật với chip EMV, công nghệ xác thực thanh toán 3D – Secure"
            ]
        },
        "terms_and_conditions": {
            "conditions": "- Cá nhân từ 18 tuổi trở lên, không bị mất hoặc hạn chế năng lực hành vi dân sự theo quy định của pháp luật.\n- Trường hợp đối tượng phát hành thẻ là người nước ngoài thì phải được phép cư trú tại Việt Nam với thời hạn từ 12 tháng trở lên\n- Xem chi tiết Điều kiện & Điều khoản: tại đây",
            "fees": "- Hạn mức thẻ: Từ 10 triệu đồng\n- Phí phát hành: Miễn phí\n- Phí thường niên:\n+ 440.000 đồng/ năm (Miễn phí năm đầu)\n+ Miễn PTN trọn đời cho 02 người thân\n- Lãi suất (%/ năm): 33%\n- Tỷ lệ thanh toán tối thiểu: 3%\n- Phí chuyển đổi ngoại tệ: 3%\n- Thời gian miễn lãi tối đa: 45 ngày​\n- Chi tiết Xem tại đây\n",
            "documents": "- CMND/ Hộ chiếu/ Căn cước công dân/ Hộ khẩu/ Giấy xác nhận tạm trú.\n- Hợp đồng lao động Sao kê lương (nếu có).\n- Hồ sơ khác\n"
        },
        "faqs": {
            "Bí kíp tăng hạn mức tín dụng": "Để tăng hạn mức nhanh chóng thật ra không khó khăn nếu bạn chứng minh được mình là người sở hữu thẻ tín dụng có trách nhiệm. Cụ thể, xuyên suốt quá trình sử dụng thẻ bạn cần:\n\nLuôn thanh toán dư nợ tín dụng đúng hạn.\nTăng thời gian sở hữu thẻ.\nChi tiêu mua sắm thường xuyên.",
            "Hạn mức thẻ tín dụng là gì?": "Hạn mức tín dụng là số tiền tối đa mà tổ chức tín dụng cấp cho bạn để bạn có thể sử dụng trên thẻ tín dụng. Mỗi ngân hàng phát hành thẻ sẽ có hạn mức tín dụng tối thiểu và hạn mức tín dụng tối đa khác nhau cho từng loại thẻ riêng biệt. Thậm chí, khi cùng sử dụng một loại thẻ tín dụng, nhưng hạn mức tín dụng cho từng khách hàng cũng khác nhau.\n",
            "Tính năng của thẻ trả trước?": "Thể hiện màu sắc, cá tính riêng thông qua hình ảnh được tự chọn in trên thẻ\nKhông cần mở tài khoản ngân hàng, tạo thẻ nhanh chóng\nQuản lý chi tiêu hiệu quả, xóa tan nỗi lo về lãi suất và hạn mức thanh toán\nMua sắm thỏa thích, thanh toán dễ dàng\nRút tiền mặt tại tất cả máy ATM của HDBank và trong hệ thống thẻ Napas\nPhạm vi sử dụng: thẻ được sử dụng trong lãnh thổ Việt Nam",
            "Thẻ trả trước là gì?": "Tương tự như thẻ ghi nợ và thẻ tín dụng, thẻ trả trước cho phép bạn thực hiện thanh toán mà không cần tiền mặt hay séc. Không như thẻ tín dụng, bạn không thanh toán trước, trả sau với thẻ trả trước. Thẻ trả trước cũng không kết nối trực tiếp với tài khoản ngân hàng như thẻ ghi nợ. Thẻ trả trước không có giá trị nào cho đến khi bạn cho tiền vào thẻ.",
            "Làm sao để thay đổi hạn mức thẻ tín dụng": "Thông thường bạn có thể chủ động yêu cầu ngân hàng phát hành thẻ xét duyệt cho bạn một hạn mức tín dụng mới, hoặc đăng ký cho phép ngân hàng xét duyệt tự động giúp bạn. Dựa vào các thói quen khi sử dụng thẻ tín dụng, ngân hàng sẽ cân nhắc việc tăng, hoặc giữ nguyên hạn mức tín dụng hiện tại của bạn\n"
        },
        "raw_text": "HDBank Mastercard Gold với Công nghệ mới Contactless cho phép thanh toán tại hàng triệu điểm chấp nhận thẻ,&nbsp; An toàn và thuận tiện trong mọi giao dịch thanh toán trên toàn thế giới. Miễn phí thường niên năm đầu Tích điểm SkyJoy không giới hạn   Trả góp 0% lãi suất tại các đối tác liên kết HDBank. Miễn phí thường niên năm đầu   Tích 1 điểm thưởng SkyJoy cho mỗi 100.000 đồng doanh thu giao dịch nội địa. Tích 5 điểm thưởng SkyJoy cho mỗi 100.000 đồng doanh thu giao dịch quốc tế. Tận hưởng vô vàn các ưu đãi, chiết khấu thanh toán từ “Happy Zone” của HDBank và tổ chức thẻ MasterCard. Dễ dàng quản lý và kiểm soát mọi chi tiêu thông qua bảng sao kê giao dịch hàng tháng và dịch vụ SMS Banking. Thanh toán dư nợ dễ dàng, không cần đến Ngân hàng với dịch vụ thanh toán tự động thẻ tín dụng của Ngân hàng hoặc chuyển khoản thanh toán tại ATM HDBank hoặc chuyển khoản thanh toán từ ngân hàng khác. Trả góp lãi suất 0% tại các đối tác liên kết của HDBank. Hoàn phí thường niên năm đầu tiên dành cho Chủ thẻ phụ * Miễn lãi tối đa 45 ngày. An toàn bảo mật với chip EMV, công nghệ xác thực thanh toán 3D – Secure - Cá nhân từ 18 tuổi trở lên, không bị mất hoặc hạn chế năng lực hành vi dân sự theo quy định của pháp luật.\n- Trường hợp đối tượng phát hành thẻ là người nước ngoài thì phải được phép cư trú tại Việt Nam với thời hạn từ 12 tháng trở lên\n- Xem chi tiết Điều kiện & Điều khoản: tại đây - Hạn mức thẻ: Từ 10 triệu đồng\n- Phí phát hành: Miễn phí\n- Phí thường niên:\n+ 440.000 đồng/ năm (Miễn phí năm đầu)\n+ Miễn PTN trọn đời cho 02 người thân\n- Lãi suất (%/ năm): 33%\n- Tỷ lệ thanh toán tối thiểu: 3%\n- Phí chuyển đổi ngoại tệ: 3%\n- Thời gian miễn lãi tối đa: 45 ngày​\n- Chi tiết Xem tại đây\n - CMND/ Hộ chiếu/ Căn cước công dân/ Hộ khẩu/ Giấy xác nhận tạm trú.\n- Hợp đồng lao động Sao kê lương (nếu có).\n- Hồ sơ khác\n Để tăng hạn mức nhanh chóng thật ra không khó khăn nếu bạn chứng minh được mình là người sở hữu thẻ tín dụng có trách nhiệm. Cụ thể, xuyên suốt quá trình sử dụng thẻ bạn cần:\n\nLuôn thanh toán dư nợ tín dụng đúng hạn.\nTăng thời gian sở hữu thẻ.\nChi tiêu mua sắm thường xuyên. Hạn mức tín dụng là số tiền tối đa mà tổ chức tín dụng cấp cho bạn để bạn có thể sử dụng trên thẻ tín dụng. Mỗi ngân hàng phát hành thẻ sẽ có hạn mức tín dụng tối thiểu và hạn mức tín dụng tối đa khác nhau cho từng loại thẻ riêng biệt. Thậm chí, khi cùng sử dụng một loại thẻ tín dụng, nhưng hạn mức tín dụng cho từng khách hàng cũng khác nhau.\n Thể hiện màu sắc, cá tính riêng thông qua hình ảnh được tự chọn in trên thẻ\nKhông cần mở tài khoản ngân hàng, tạo thẻ nhanh chóng\nQuản lý chi tiêu hiệu quả, xóa tan nỗi lo về lãi suất và hạn mức thanh toán\nMua sắm thỏa thích, thanh toán dễ dàng\nRút tiền mặt tại tất cả máy ATM của HDBank và trong hệ thống thẻ Napas\nPhạm vi sử dụng: thẻ được sử dụng trong lãnh thổ Việt Nam Tương tự như thẻ ghi nợ và thẻ tín dụng, thẻ trả trước cho phép bạn thực hiện thanh toán mà không cần tiền mặt hay séc. Không như thẻ tín dụng, bạn không thanh toán trước, trả sau với thẻ trả trước. Thẻ trả trước cũng không kết nối trực tiếp với tài khoản ngân hàng như thẻ ghi nợ. Thẻ trả trước không có giá trị nào cho đến khi bạn cho tiền vào thẻ. Thông thường bạn có thể chủ động yêu cầu ngân hàng phát hành thẻ xét duyệt cho bạn một hạn mức tín dụng mới, hoặc đăng ký cho phép ngân hàng xét duyệt tự động giúp bạn. Dựa vào các thói quen khi sử dụng thẻ tín dụng, ngân hàng sẽ cân nhắc việc tăng, hoặc giữ nguyên hạn mức tín dụng hiện tại của bạn"
    },
    {
        "metadata": {
            "card_name": "HDBank Napas",
            "card_image": "https://cdn.hdbank.com.vn/hdbank-file/product/334248266106827492742365267952_1677724904737.jpg",
            "url": "https://hdbank.com.vn/vi/personal/product/detail/the/the-ghi-no/hdbank-napas",
            "card_type": "The Ghi No",
            "category": "banking_cards",
            "bank": "HDBank",
            "last_updated": "2024-11-29"
        },
        "description": "Sở hữu thẻ HDBank Napas Debit, khách hàng có thể giao dịch tại trụ ATM rộng lớn, thanh toán tại hàng triệu điểm chấp nhận thẻ trên toàn quốc.​",
        "features": {
            "gifts": [
                "Miễn phi phát hành thẻ"
            ],
            "privileges": [
                " Hưởng lãi không kỳ hạn",
                "trên số dư tài khoản thanh toán.",
                "Rút tiền mặt dễ dàng",
                "với mạng lưới ATM rộng lớn, thanh toán tại hàng triệu điểm chấp nhận thẻ trên toàn quốc.",
                "An toàn, tiện lợi",
                " không cần mang nhiều tiền mặt hàng ngày."
            ],
            "benefits": [
                "Rút tiền mặt dễ dàng với mạng lưới ATM rộng lớn, thanh toán tại hàng triệu điểm chấp nhận thẻ trên toàn quốc.",
                "Thuận tiện khi thanh toán hóa đơn, chuyển khoản, dễ dàng theo dõi & quản lý mọi giao dịch thẻ qua dịch vụ Ngân hàng điện tử.",
                "An toàn, tiện lợi, không cần mang nhiều tiền mặt hàng ngày.",
                "Hưởng lãi không kỳ hạn trên số dư tài khoản thanh toán.",
                "Tận hưởng các ưu đãi, chiết khấu thanh toán từ “Happy Zone” của HDBank.",
                "Rút tiền mặt dễ dàng với mạng lưới ATM rộng lớn.",
                "Thanh toán tại hàng triệu điểm chấp nhận thẻ trên toàn quốc.",
                "Nhận lương và các khoản thu nhập khác (lãi tiết kiệm, cổ tức,...) qua thẻ."
            ]
        },
        "terms_and_conditions": {
            "conditions": "- Cá nhân từ 18 tuổi trở lên, không bị mất hoặc hạn chế năng lực hành vi dân sự theo quy định của pháp luật.\n- Trường hợp đối tượng phát hành thẻ là người nước ngoài thì phải được phép cư trú tại Việt Nam với thời hạn từ 12 tháng trở lên.\n- Xem chi tiết Điều kiện & Điều khoản tại đây",
            "fees": "- Phí phát hành: Miễn phí\n- Phí thường niên: 60.000 đồng/ năm\n- Lãi suất (%/ năm): Hưởng lãi không kỳ hạn trên số dư tài khoản của khách hàng\n- Xem chi tiết tại đây\n",
            "documents": "- Đăng ký trực tiếp tại Chi nhánh/Phòng Giao dịch HDBank gần nhất (tra cứu mạng lưới HDBank tại đây).\n- CMND/CCCD/ Hộ chiếu còn hiệu lực.\n"
        },
        "faqs": {
            "Bí kíp tăng hạn mức tín dụng": "Để tăng hạn mức nhanh chóng thật ra không khó khăn nếu bạn chứng minh được mình là người sở hữu thẻ tín dụng có trách nhiệm. Cụ thể, xuyên suốt quá trình sử dụng thẻ bạn cần:\n\nLuôn thanh toán dư nợ tín dụng đúng hạn.\nTăng thời gian sở hữu thẻ.\nChi tiêu mua sắm thường xuyên.",
            "Hạn mức thẻ tín dụng là gì?": "Hạn mức tín dụng là số tiền tối đa mà tổ chức tín dụng cấp cho bạn để bạn có thể sử dụng trên thẻ tín dụng. Mỗi ngân hàng phát hành thẻ sẽ có hạn mức tín dụng tối thiểu và hạn mức tín dụng tối đa khác nhau cho từng loại thẻ riêng biệt. Thậm chí, khi cùng sử dụng một loại thẻ tín dụng, nhưng hạn mức tín dụng cho từng khách hàng cũng khác nhau.\n",
            "Tính năng của thẻ trả trước?": "Thể hiện màu sắc, cá tính riêng thông qua hình ảnh được tự chọn in trên thẻ\nKhông cần mở tài khoản ngân hàng, tạo thẻ nhanh chóng\nQuản lý chi tiêu hiệu quả, xóa tan nỗi lo về lãi suất và hạn mức thanh toán\nMua sắm thỏa thích, thanh toán dễ dàng\nRút tiền mặt tại tất cả máy ATM của HDBank và trong hệ thống thẻ Napas\nPhạm vi sử dụng: thẻ được sử dụng trong lãnh thổ Việt Nam",
            "Thẻ trả trước là gì?": "Tương tự như thẻ ghi nợ và thẻ tín dụng, thẻ trả trước cho phép bạn thực hiện thanh toán mà không cần tiền mặt hay séc. Không như thẻ tín dụng, bạn không thanh toán trước, trả sau với thẻ trả trước. Thẻ trả trước cũng không kết nối trực tiếp với tài khoản ngân hàng như thẻ ghi nợ. Thẻ trả trước không có giá trị nào cho đến khi bạn cho tiền vào thẻ.",
            "Làm sao để thay đổi hạn mức thẻ tín dụng": "Thông thường bạn có thể chủ động yêu cầu ngân hàng phát hành thẻ xét duyệt cho bạn một hạn mức tín dụng mới, hoặc đăng ký cho phép ngân hàng xét duyệt tự động giúp bạn. Dựa vào các thói quen khi sử dụng thẻ tín dụng, ngân hàng sẽ cân nhắc việc tăng, hoặc giữ nguyên hạn mức tín dụng hiện tại của bạn\n"
        },
        "raw_text": "Sở hữu thẻ HDBank Napas Debit, khách hàng có thể giao dịch tại trụ ATM rộng lớn, thanh toán tại hàng triệu điểm chấp nhận thẻ trên toàn quốc.​ Miễn phi phát hành thẻ  Hưởng lãi không kỳ hạn trên số dư tài khoản thanh toán. Rút tiền mặt dễ dàng với mạng lưới ATM rộng lớn, thanh toán tại hàng triệu điểm chấp nhận thẻ trên toàn quốc. An toàn, tiện lợi  không cần mang nhiều tiền mặt hàng ngày. Rút tiền mặt dễ dàng với mạng lưới ATM rộng lớn, thanh toán tại hàng triệu điểm chấp nhận thẻ trên toàn quốc. Thuận tiện khi thanh toán hóa đơn, chuyển khoản, dễ dàng theo dõi & quản lý mọi giao dịch thẻ qua dịch vụ Ngân hàng điện tử. An toàn, tiện lợi, không cần mang nhiều tiền mặt hàng ngày. Hưởng lãi không kỳ hạn trên số dư tài khoản thanh toán. Tận hưởng các ưu đãi, chiết khấu thanh toán từ “Happy Zone” của HDBank. Rút tiền mặt dễ dàng với mạng lưới ATM rộng lớn. Thanh toán tại hàng triệu điểm chấp nhận thẻ trên toàn quốc. Nhận lương và các khoản thu nhập khác (lãi tiết kiệm, cổ tức,...) qua thẻ. - Cá nhân từ 18 tuổi trở lên, không bị mất hoặc hạn chế năng lực hành vi dân sự theo quy định của pháp luật.\n- Trường hợp đối tượng phát hành thẻ là người nước ngoài thì phải được phép cư trú tại Việt Nam với thời hạn từ 12 tháng trở lên.\n- Xem chi tiết Điều kiện & Điều khoản tại đây - Phí phát hành: Miễn phí\n- Phí thường niên: 60.000 đồng/ năm\n- Lãi suất (%/ năm): Hưởng lãi không kỳ hạn trên số dư tài khoản của khách hàng\n- Xem chi tiết tại đây\n - Đăng ký trực tiếp tại Chi nhánh/Phòng Giao dịch HDBank gần nhất (tra cứu mạng lưới HDBank tại đây).\n- CMND/CCCD/ Hộ chiếu còn hiệu lực.\n Để tăng hạn mức nhanh chóng thật ra không khó khăn nếu bạn chứng minh được mình là người sở hữu thẻ tín dụng có trách nhiệm. Cụ thể, xuyên suốt quá trình sử dụng thẻ bạn cần:\n\nLuôn thanh toán dư nợ tín dụng đúng hạn.\nTăng thời gian sở hữu thẻ.\nChi tiêu mua sắm thường xuyên. Hạn mức tín dụng là số tiền tối đa mà tổ chức tín dụng cấp cho bạn để bạn có thể sử dụng trên thẻ tín dụng. Mỗi ngân hàng phát hành thẻ sẽ có hạn mức tín dụng tối thiểu và hạn mức tín dụng tối đa khác nhau cho từng loại thẻ riêng biệt. Thậm chí, khi cùng sử dụng một loại thẻ tín dụng, nhưng hạn mức tín dụng cho từng khách hàng cũng khác nhau.\n Thể hiện màu sắc, cá tính riêng thông qua hình ảnh được tự chọn in trên thẻ\nKhông cần mở tài khoản ngân hàng, tạo thẻ nhanh chóng\nQuản lý chi tiêu hiệu quả, xóa tan nỗi lo về lãi suất và hạn mức thanh toán\nMua sắm thỏa thích, thanh toán dễ dàng\nRút tiền mặt tại tất cả máy ATM của HDBank và trong hệ thống thẻ Napas\nPhạm vi sử dụng: thẻ được sử dụng trong lãnh thổ Việt Nam Tương tự như thẻ ghi nợ và thẻ tín dụng, thẻ trả trước cho phép bạn thực hiện thanh toán mà không cần tiền mặt hay séc. Không như thẻ tín dụng, bạn không thanh toán trước, trả sau với thẻ trả trước. Thẻ trả trước cũng không kết nối trực tiếp với tài khoản ngân hàng như thẻ ghi nợ. Thẻ trả trước không có giá trị nào cho đến khi bạn cho tiền vào thẻ. Thông thường bạn có thể chủ động yêu cầu ngân hàng phát hành thẻ xét duyệt cho bạn một hạn mức tín dụng mới, hoặc đăng ký cho phép ngân hàng xét duyệt tự động giúp bạn. Dựa vào các thói quen khi sử dụng thẻ tín dụng, ngân hàng sẽ cân nhắc việc tăng, hoặc giữ nguyên hạn mức tín dụng hiện tại của bạn"
    },
    {
        "metadata": {
            "card_name": "HDBank Liên kết sinh viên",
            "card_image": "https://cdn.hdbank.com.vn/hdbank-file/product/SV.jpg",
            "url": "https://hdbank.com.vn/vi/personal/product/detail/the/the-ghi-no/hdbank-lien-ket-sinh-vien",
            "card_type": "The Ghi No",
            "category": "banking_cards",
            "bank": "HDBank",
            "last_updated": "2024-11-29"
        },
        "description": "Là sinh viên - bạn nên sắm cho mình chiếc thẻ này để nhận và chuyển tiền học phí dễ dàng, nhanh chóng, tiện lợi. Tài khoản được an toàn, không cần mang nhiều tiền mặt trong các giao dịch hàng ngày.",
        "features": {
            "gifts": [],
            "privileges": [
                "Đối với sinh viên",
                "Nhận và chuyển tiền học phí dễ dàng, nhanh chóng, tiện lợi.",
                "Đối với nhà trường",
                " - Giảm tình trạng mất thẻ Sinh viên, tiết kiệm chi phí.\n - Quản lý sinh viên hiện đại & hiệu quả.\n - Quảng bá thương hiệu nhà trường.",
                "Miễn phí thường niên năm đầu",
                " "
            ],
            "benefits": [
                "Nhận và chuyển tiền học phí dễ dàng, nhanh chóng, tiện lợi.",
                "Giữ tiền an toàn, không cần mang nhiều tiền mặt trong các giao dịch hàng ngày.",
                "Rút tiền miễn phí tại các máy rút tiền tự động của HDBank.",
                "Hưởng lãi không kỳ hạn trên số dư tài khoản của khách hàng.",
                "Giảm tình trạng mất thẻ Sinh viên.",
                "Tiết kiệm chi phí.",
                "Quản lý sinh viên hiện đại & hiệu quả.",
                "Quảng bá thương hiệu nhà trường.",
                "Vừa là thẻ sinh viên vừa là thẻ ngân hàng.",
                "Sử dụng thẻ để ra vào trường, thư viện, thanh toán học phí...",
                "Thanh toán an toàn, nhanh chóng, tiện lợi qua tất cả các kênh thanh toán của HDBank.",
                "Chuyển khoản nội bộ và trong nước qua ATM, eBanking, mBanking.",
                "Nạp tiền điện thoại, thanh toán hóa đơn (điện thoại, tiền điện, internet…), nạp thẻ game thông qua SMS Banking, eBanking."
            ]
        },
        "terms_and_conditions": {
            "conditions": "- Cá nhân từ 18 tuổi trở lên, không bị mất hoặc hạn chế năng lực hành vi dân sự theo quy định của pháp luật.\n- Trường hợp đối tượng phát hành thẻ là người nước ngoài thì phải được phép cư trú tại Việt Nam với thời hạn từ 12 tháng trở lên.\n- Xem chi tiết Điều kiện & Điều khoản tại đây",
            "fees": "- Phí phát hành: Miễn phí\n- Phí thường niên: 60.000 đồng/ năm\n- Lãi suất (%/ năm): Hưởng lãi không kỳ hạn trên số dư tài khoản của khách hàng\n- Xem chi tiết tại đây\n",
            "documents": "- Đăng ký trực tiếp tại Chi nhánh/Phòng Giao dịch HDBank gần nhất (tra cứu mạng lưới HDBank tại đây).\n- CMND/CCCD/ Hộ chiếu còn hiệu lực\n"
        },
        "faqs": {
            "Bí kíp tăng hạn mức tín dụng": "Để tăng hạn mức nhanh chóng thật ra không khó khăn nếu bạn chứng minh được mình là người sở hữu thẻ tín dụng có trách nhiệm. Cụ thể, xuyên suốt quá trình sử dụng thẻ bạn cần:\n\nLuôn thanh toán dư nợ tín dụng đúng hạn.\nTăng thời gian sở hữu thẻ.\nChi tiêu mua sắm thường xuyên.",
            "Hạn mức thẻ tín dụng là gì?": "Hạn mức tín dụng là số tiền tối đa mà tổ chức tín dụng cấp cho bạn để bạn có thể sử dụng trên thẻ tín dụng. Mỗi ngân hàng phát hành thẻ sẽ có hạn mức tín dụng tối thiểu và hạn mức tín dụng tối đa khác nhau cho từng loại thẻ riêng biệt. Thậm chí, khi cùng sử dụng một loại thẻ tín dụng, nhưng hạn mức tín dụng cho từng khách hàng cũng khác nhau.\n",
            "Tính năng của thẻ trả trước?": "Thể hiện màu sắc, cá tính riêng thông qua hình ảnh được tự chọn in trên thẻ\nKhông cần mở tài khoản ngân hàng, tạo thẻ nhanh chóng\nQuản lý chi tiêu hiệu quả, xóa tan nỗi lo về lãi suất và hạn mức thanh toán\nMua sắm thỏa thích, thanh toán dễ dàng\nRút tiền mặt tại tất cả máy ATM của HDBank và trong hệ thống thẻ Napas\nPhạm vi sử dụng: thẻ được sử dụng trong lãnh thổ Việt Nam",
            "Thẻ trả trước là gì?": "Tương tự như thẻ ghi nợ và thẻ tín dụng, thẻ trả trước cho phép bạn thực hiện thanh toán mà không cần tiền mặt hay séc. Không như thẻ tín dụng, bạn không thanh toán trước, trả sau với thẻ trả trước. Thẻ trả trước cũng không kết nối trực tiếp với tài khoản ngân hàng như thẻ ghi nợ. Thẻ trả trước không có giá trị nào cho đến khi bạn cho tiền vào thẻ.",
            "Làm sao để thay đổi hạn mức thẻ tín dụng": "Thông thường bạn có thể chủ động yêu cầu ngân hàng phát hành thẻ xét duyệt cho bạn một hạn mức tín dụng mới, hoặc đăng ký cho phép ngân hàng xét duyệt tự động giúp bạn. Dựa vào các thói quen khi sử dụng thẻ tín dụng, ngân hàng sẽ cân nhắc việc tăng, hoặc giữ nguyên hạn mức tín dụng hiện tại của bạn\n"
        },
        "raw_text": "Là sinh viên - bạn nên sắm cho mình chiếc thẻ này để nhận và chuyển tiền học phí dễ dàng, nhanh chóng, tiện lợi. Tài khoản được an toàn, không cần mang nhiều tiền mặt trong các giao dịch hàng ngày.  Đối với sinh viên Nhận và chuyển tiền học phí dễ dàng, nhanh chóng, tiện lợi. Đối với nhà trường  - Giảm tình trạng mất thẻ Sinh viên, tiết kiệm chi phí.\n - Quản lý sinh viên hiện đại & hiệu quả.\n - Quảng bá thương hiệu nhà trường. Miễn phí thường niên năm đầu   Nhận và chuyển tiền học phí dễ dàng, nhanh chóng, tiện lợi. Giữ tiền an toàn, không cần mang nhiều tiền mặt trong các giao dịch hàng ngày. Rút tiền miễn phí tại các máy rút tiền tự động của HDBank. Hưởng lãi không kỳ hạn trên số dư tài khoản của khách hàng. Giảm tình trạng mất thẻ Sinh viên. Tiết kiệm chi phí. Quản lý sinh viên hiện đại & hiệu quả. Quảng bá thương hiệu nhà trường. Vừa là thẻ sinh viên vừa là thẻ ngân hàng. Sử dụng thẻ để ra vào trường, thư viện, thanh toán học phí... Thanh toán an toàn, nhanh chóng, tiện lợi qua tất cả các kênh thanh toán của HDBank. Chuyển khoản nội bộ và trong nước qua ATM, eBanking, mBanking. Nạp tiền điện thoại, thanh toán hóa đơn (điện thoại, tiền điện, internet…), nạp thẻ game thông qua SMS Banking, eBanking. - Cá nhân từ 18 tuổi trở lên, không bị mất hoặc hạn chế năng lực hành vi dân sự theo quy định của pháp luật.\n- Trường hợp đối tượng phát hành thẻ là người nước ngoài thì phải được phép cư trú tại Việt Nam với thời hạn từ 12 tháng trở lên.\n- Xem chi tiết Điều kiện & Điều khoản tại đây - Phí phát hành: Miễn phí\n- Phí thường niên: 60.000 đồng/ năm\n- Lãi suất (%/ năm): Hưởng lãi không kỳ hạn trên số dư tài khoản của khách hàng\n- Xem chi tiết tại đây\n - Đăng ký trực tiếp tại Chi nhánh/Phòng Giao dịch HDBank gần nhất (tra cứu mạng lưới HDBank tại đây).\n- CMND/CCCD/ Hộ chiếu còn hiệu lực\n Để tăng hạn mức nhanh chóng thật ra không khó khăn nếu bạn chứng minh được mình là người sở hữu thẻ tín dụng có trách nhiệm. Cụ thể, xuyên suốt quá trình sử dụng thẻ bạn cần:\n\nLuôn thanh toán dư nợ tín dụng đúng hạn.\nTăng thời gian sở hữu thẻ.\nChi tiêu mua sắm thường xuyên. Hạn mức tín dụng là số tiền tối đa mà tổ chức tín dụng cấp cho bạn để bạn có thể sử dụng trên thẻ tín dụng. Mỗi ngân hàng phát hành thẻ sẽ có hạn mức tín dụng tối thiểu và hạn mức tín dụng tối đa khác nhau cho từng loại thẻ riêng biệt. Thậm chí, khi cùng sử dụng một loại thẻ tín dụng, nhưng hạn mức tín dụng cho từng khách hàng cũng khác nhau.\n Thể hiện màu sắc, cá tính riêng thông qua hình ảnh được tự chọn in trên thẻ\nKhông cần mở tài khoản ngân hàng, tạo thẻ nhanh chóng\nQuản lý chi tiêu hiệu quả, xóa tan nỗi lo về lãi suất và hạn mức thanh toán\nMua sắm thỏa thích, thanh toán dễ dàng\nRút tiền mặt tại tất cả máy ATM của HDBank và trong hệ thống thẻ Napas\nPhạm vi sử dụng: thẻ được sử dụng trong lãnh thổ Việt Nam Tương tự như thẻ ghi nợ và thẻ tín dụng, thẻ trả trước cho phép bạn thực hiện thanh toán mà không cần tiền mặt hay séc. Không như thẻ tín dụng, bạn không thanh toán trước, trả sau với thẻ trả trước. Thẻ trả trước cũng không kết nối trực tiếp với tài khoản ngân hàng như thẻ ghi nợ. Thẻ trả trước không có giá trị nào cho đến khi bạn cho tiền vào thẻ. Thông thường bạn có thể chủ động yêu cầu ngân hàng phát hành thẻ xét duyệt cho bạn một hạn mức tín dụng mới, hoặc đăng ký cho phép ngân hàng xét duyệt tự động giúp bạn. Dựa vào các thói quen khi sử dụng thẻ tín dụng, ngân hàng sẽ cân nhắc việc tăng, hoặc giữ nguyên hạn mức tín dụng hiện tại của bạn"
    },
    {
        "metadata": {
            "card_name": "HDBank Napas Coca Cola",
            "card_image": "https://cdn.hdbank.com.vn/hdbank-file/product/coca_new.jpg",
            "url": "https://hdbank.com.vn/vi/personal/product/detail/the/the-ghi-no/hdbank-napas-cocacola",
            "card_type": "The Ghi No",
            "category": "banking_cards",
            "bank": "HDBank",
            "last_updated": "2024-11-29"
        },
        "description": "Khách hàng có thể giao dịch tại trụ ATM rộng lớn, thanh toán tại hàng triệu điểm chấp nhận thẻ trên toàn quốc.",
        "features": {
            "gifts": [
                "Miễn phí phát hành thẻ."
            ],
            "privileges": [
                "Hưởng lãi không kỳ hạn",
                "trên số dư tài khoản thanh toán.",
                "Rút tiền mặt dễ dàng",
                "với mạng lưới ATM rộng lớn, thanh toán tại hàng triệu điểm chấp nhận thẻ trên toàn quốc.",
                "An toàn, tiện lợi",
                "khách hàng không cần mang nhiều tiền mặt trong các giao dịch hàng ngày."
            ],
            "benefits": [
                "An toàn, tiện lợi, khách hàng không cần mang nhiều tiền mặt trong các giao dịch hàng ngày.",
                "Dễ dàng theo dõi và quản lý thẻ qua dịch vụ Ngân hàng điện tử.",
                "Hưởng lãi không kỳ hạn trên số dư tài khoản của khách hàng.",
                "Mua hàng trực tuyến tiện lợi tại nhiều website, thanh toán qua các ứng dụng di động thời thượng.",
                "Chuyển khoản nhanh 24/ 7, rút tiền mặt dễ dàng với mạng lưới ATM rộng lớn.",
                "Tận hưởng các ưu đãi, chiết khấu thanh toán từ “Happy Zone” của HDBank.",
                "Thuận tiện khi thanh toán hóa đơn mua hàng.",
                "Chuyển khoản nhanh 24/7.",
                "Rút tiền mặt dễ dàng với mạng lưới ATM rộng lớn."
            ]
        },
        "terms_and_conditions": {
            "conditions": "- Cá nhân từ 18 tuổi trở lên, không bị mất hoặc hạn chế năng lực hành vi dân sự theo quy định của pháp luật.\n- Trường hợp đối tượng phát hành thẻ là người nước ngoài thì phải được phép cư trú tại Việt Nam với thời hạn từ 12 tháng trở lên.\n- Xem chi tiết Điều kiện & Điều khoản tại đây",
            "fees": "- Phí phát hành: Miễn phí\n- Phí thường niên: 60.000 đồng/ năm\n- Lãi suất (%/ năm): Hưởng lãi không kỳ hạn trên số dư tài khoản của khách hàng\n- Xem chi tiết tại đây\n",
            "documents": "- Đăng ký trực tiếp tại Chi nhánh/Phòng Giao dịch HDBank gần nhất (tra cứu mạng lưới HDBank tại đây).\n- CMND/CCCD/ Hộ chiếu còn hiệu lực.\n"
        },
        "faqs": {
            "Bí kíp tăng hạn mức tín dụng": "Để tăng hạn mức nhanh chóng thật ra không khó khăn nếu bạn chứng minh được mình là người sở hữu thẻ tín dụng có trách nhiệm. Cụ thể, xuyên suốt quá trình sử dụng thẻ bạn cần:\n\nLuôn thanh toán dư nợ tín dụng đúng hạn.\nTăng thời gian sở hữu thẻ.\nChi tiêu mua sắm thường xuyên.",
            "Hạn mức thẻ tín dụng là gì?": "Hạn mức tín dụng là số tiền tối đa mà tổ chức tín dụng cấp cho bạn để bạn có thể sử dụng trên thẻ tín dụng. Mỗi ngân hàng phát hành thẻ sẽ có hạn mức tín dụng tối thiểu và hạn mức tín dụng tối đa khác nhau cho từng loại thẻ riêng biệt. Thậm chí, khi cùng sử dụng một loại thẻ tín dụng, nhưng hạn mức tín dụng cho từng khách hàng cũng khác nhau.\n",
            "Tính năng của thẻ trả trước?": "Thể hiện màu sắc, cá tính riêng thông qua hình ảnh được tự chọn in trên thẻ\nKhông cần mở tài khoản ngân hàng, tạo thẻ nhanh chóng\nQuản lý chi tiêu hiệu quả, xóa tan nỗi lo về lãi suất và hạn mức thanh toán\nMua sắm thỏa thích, thanh toán dễ dàng\nRút tiền mặt tại tất cả máy ATM của HDBank và trong hệ thống thẻ Napas\nPhạm vi sử dụng: thẻ được sử dụng trong lãnh thổ Việt Nam",
            "Thẻ trả trước là gì?": "Tương tự như thẻ ghi nợ và thẻ tín dụng, thẻ trả trước cho phép bạn thực hiện thanh toán mà không cần tiền mặt hay séc. Không như thẻ tín dụng, bạn không thanh toán trước, trả sau với thẻ trả trước. Thẻ trả trước cũng không kết nối trực tiếp với tài khoản ngân hàng như thẻ ghi nợ. Thẻ trả trước không có giá trị nào cho đến khi bạn cho tiền vào thẻ.",
            "Làm sao để thay đổi hạn mức thẻ tín dụng": "Thông thường bạn có thể chủ động yêu cầu ngân hàng phát hành thẻ xét duyệt cho bạn một hạn mức tín dụng mới, hoặc đăng ký cho phép ngân hàng xét duyệt tự động giúp bạn. Dựa vào các thói quen khi sử dụng thẻ tín dụng, ngân hàng sẽ cân nhắc việc tăng, hoặc giữ nguyên hạn mức tín dụng hiện tại của bạn\n"
        },
        "raw_text": "Khách hàng có thể giao dịch tại trụ ATM rộng lớn, thanh toán tại hàng triệu điểm chấp nhận thẻ trên toàn quốc. Miễn phí phát hành thẻ. Hưởng lãi không kỳ hạn trên số dư tài khoản thanh toán. Rút tiền mặt dễ dàng với mạng lưới ATM rộng lớn, thanh toán tại hàng triệu điểm chấp nhận thẻ trên toàn quốc. An toàn, tiện lợi khách hàng không cần mang nhiều tiền mặt trong các giao dịch hàng ngày. An toàn, tiện lợi, khách hàng không cần mang nhiều tiền mặt trong các giao dịch hàng ngày. Dễ dàng theo dõi và quản lý thẻ qua dịch vụ Ngân hàng điện tử. Hưởng lãi không kỳ hạn trên số dư tài khoản của khách hàng. Mua hàng trực tuyến tiện lợi tại nhiều website, thanh toán qua các ứng dụng di động thời thượng. Chuyển khoản nhanh 24/ 7, rút tiền mặt dễ dàng với mạng lưới ATM rộng lớn. Tận hưởng các ưu đãi, chiết khấu thanh toán từ “Happy Zone” của HDBank. Thuận tiện khi thanh toán hóa đơn mua hàng. Chuyển khoản nhanh 24/7. Rút tiền mặt dễ dàng với mạng lưới ATM rộng lớn. - Cá nhân từ 18 tuổi trở lên, không bị mất hoặc hạn chế năng lực hành vi dân sự theo quy định của pháp luật.\n- Trường hợp đối tượng phát hành thẻ là người nước ngoài thì phải được phép cư trú tại Việt Nam với thời hạn từ 12 tháng trở lên.\n- Xem chi tiết Điều kiện & Điều khoản tại đây - Phí phát hành: Miễn phí\n- Phí thường niên: 60.000 đồng/ năm\n- Lãi suất (%/ năm): Hưởng lãi không kỳ hạn trên số dư tài khoản của khách hàng\n- Xem chi tiết tại đây\n - Đăng ký trực tiếp tại Chi nhánh/Phòng Giao dịch HDBank gần nhất (tra cứu mạng lưới HDBank tại đây).\n- CMND/CCCD/ Hộ chiếu còn hiệu lực.\n Để tăng hạn mức nhanh chóng thật ra không khó khăn nếu bạn chứng minh được mình là người sở hữu thẻ tín dụng có trách nhiệm. Cụ thể, xuyên suốt quá trình sử dụng thẻ bạn cần:\n\nLuôn thanh toán dư nợ tín dụng đúng hạn.\nTăng thời gian sở hữu thẻ.\nChi tiêu mua sắm thường xuyên. Hạn mức tín dụng là số tiền tối đa mà tổ chức tín dụng cấp cho bạn để bạn có thể sử dụng trên thẻ tín dụng. Mỗi ngân hàng phát hành thẻ sẽ có hạn mức tín dụng tối thiểu và hạn mức tín dụng tối đa khác nhau cho từng loại thẻ riêng biệt. Thậm chí, khi cùng sử dụng một loại thẻ tín dụng, nhưng hạn mức tín dụng cho từng khách hàng cũng khác nhau.\n Thể hiện màu sắc, cá tính riêng thông qua hình ảnh được tự chọn in trên thẻ\nKhông cần mở tài khoản ngân hàng, tạo thẻ nhanh chóng\nQuản lý chi tiêu hiệu quả, xóa tan nỗi lo về lãi suất và hạn mức thanh toán\nMua sắm thỏa thích, thanh toán dễ dàng\nRút tiền mặt tại tất cả máy ATM của HDBank và trong hệ thống thẻ Napas\nPhạm vi sử dụng: thẻ được sử dụng trong lãnh thổ Việt Nam Tương tự như thẻ ghi nợ và thẻ tín dụng, thẻ trả trước cho phép bạn thực hiện thanh toán mà không cần tiền mặt hay séc. Không như thẻ tín dụng, bạn không thanh toán trước, trả sau với thẻ trả trước. Thẻ trả trước cũng không kết nối trực tiếp với tài khoản ngân hàng như thẻ ghi nợ. Thẻ trả trước không có giá trị nào cho đến khi bạn cho tiền vào thẻ. Thông thường bạn có thể chủ động yêu cầu ngân hàng phát hành thẻ xét duyệt cho bạn một hạn mức tín dụng mới, hoặc đăng ký cho phép ngân hàng xét duyệt tự động giúp bạn. Dựa vào các thói quen khi sử dụng thẻ tín dụng, ngân hàng sẽ cân nhắc việc tăng, hoặc giữ nguyên hạn mức tín dụng hiện tại của bạn"
    },
    {
        "metadata": {
            "card_name": "Thẻ ghi nợ hình ảnh (MyCard Debit)",
            "card_image": "https://cdn.hdbank.com.vn/hdbank-file/product/mycard_new.jpg",
            "url": "https://hdbank.com.vn/vi/personal/product/detail/the/the-ghi-no/the-ghi-no-hinh-anh-mycard-debit",
            "card_type": "The Ghi No",
            "category": "banking_cards",
            "bank": "HDBank",
            "last_updated": "2024-11-29"
        },
        "description": "Tự do lựa chọn hình ảnh phù hợp với cá tính riêng của bạn. Vô tư thực hiện giao dịch trên số dư tài khoản thanh toán của mình",
        "features": {
            "gifts": [],
            "privileges": [
                "Cho phép in hình ảnh trên thẻ",
                "theo nhu cầu của chủ thẻ.",
                "Hưởng lãi không kỳ hạn",
                "trên số dư tài khoản thanh toán.",
                " Rút tiền mặt dễ dàng ",
                "với mạng lưới ATM rộng lớn, thanh toán tại hàng triệu điểm chấp nhận thẻ trên toàn quốc."
            ],
            "benefits": [
                "Rút tiền mặt dễ dàng với mạng lưới ATM rộng lớn, thanh toán tại hàng triệu điểm chấp nhận thẻ trên toàn quốc.",
                "Thuận tiện khi thanh toán hóa đơn, chuyển khoản, dễ dàng theo dõi & quản lý mọi giao dịch thẻ qua dịch vụ Ngân hàng điện tử.",
                "An toàn, tiện lợi, không cần mang nhiều tiền mặt hàng ngày.",
                "Hưởng lãi không kỳ hạn trên số dư tài khoản thanh toán.",
                "Tận hưởng đến 50% ưu đãi từ “Happy Zone” như ẩm thực, mua sắm, giải trí,...",
                "Cho phép in hình ảnh trên thẻ theo nhu cầu của chủ thẻ.",
                "Rút tiền mặt, chuyển khoản, thanh toán hóa đơn, tra cứu số dư và kiểm soát tài khoản dễ dàng với mạng lưới ATM rộng lớn và dịch vụ eBanking.",
                "Mua sắm, thanh toán trực tuyến và tại các cửa hàng chấp nhận thẻ trên toàn quốc.",
                "Nhận lương và các khoản thu nhập khác (lãi tiết kiệm, cổ tức,...) qua thẻ."
            ]
        },
        "terms_and_conditions": {
            "conditions": "- Cá nhân từ 18 tuổi trở lên, không bị mất hoặc hạn chế năng lực hành vi dân sự theo quy định của pháp luật.\n- Trường hợp đối tượng phát hành thẻ là người nước ngoài thì phải được phép cư trú tại Việt Nam với thời hạn từ 12 tháng trở lên.\n- Xem chi tiết Điều kiện & Điều khoản tại đây",
            "fees": "- Phí phát hành: Miễn phí\n- Phí thường niên: 99.000 đồng/ năm\n- Lãi suất (%/ năm): Hưởng lãi không kỳ hạn trên số dư tài khoản của khách hàng\n- Xem chi tiết tại đây\n",
            "documents": "- Đăng ký trực tiếp tại Chi nhánh/Phòng Giao dịch HDBank gần nhất (tra cứu mạng lưới HDBank tại đây).\n- CMND/CCCD/ Hộ chiếu còn hiệu lực.\n"
        },
        "faqs": {
            "Bí kíp tăng hạn mức tín dụng": "Để tăng hạn mức nhanh chóng thật ra không khó khăn nếu bạn chứng minh được mình là người sở hữu thẻ tín dụng có trách nhiệm. Cụ thể, xuyên suốt quá trình sử dụng thẻ bạn cần:\n\nLuôn thanh toán dư nợ tín dụng đúng hạn.\nTăng thời gian sở hữu thẻ.\nChi tiêu mua sắm thường xuyên.",
            "Hạn mức thẻ tín dụng là gì?": "Hạn mức tín dụng là số tiền tối đa mà tổ chức tín dụng cấp cho bạn để bạn có thể sử dụng trên thẻ tín dụng. Mỗi ngân hàng phát hành thẻ sẽ có hạn mức tín dụng tối thiểu và hạn mức tín dụng tối đa khác nhau cho từng loại thẻ riêng biệt. Thậm chí, khi cùng sử dụng một loại thẻ tín dụng, nhưng hạn mức tín dụng cho từng khách hàng cũng khác nhau.\n",
            "Tính năng của thẻ trả trước?": "Thể hiện màu sắc, cá tính riêng thông qua hình ảnh được tự chọn in trên thẻ\nKhông cần mở tài khoản ngân hàng, tạo thẻ nhanh chóng\nQuản lý chi tiêu hiệu quả, xóa tan nỗi lo về lãi suất và hạn mức thanh toán\nMua sắm thỏa thích, thanh toán dễ dàng\nRút tiền mặt tại tất cả máy ATM của HDBank và trong hệ thống thẻ Napas\nPhạm vi sử dụng: thẻ được sử dụng trong lãnh thổ Việt Nam",
            "Thẻ trả trước là gì?": "Tương tự như thẻ ghi nợ và thẻ tín dụng, thẻ trả trước cho phép bạn thực hiện thanh toán mà không cần tiền mặt hay séc. Không như thẻ tín dụng, bạn không thanh toán trước, trả sau với thẻ trả trước. Thẻ trả trước cũng không kết nối trực tiếp với tài khoản ngân hàng như thẻ ghi nợ. Thẻ trả trước không có giá trị nào cho đến khi bạn cho tiền vào thẻ.",
            "Làm sao để thay đổi hạn mức thẻ tín dụng": "Thông thường bạn có thể chủ động yêu cầu ngân hàng phát hành thẻ xét duyệt cho bạn một hạn mức tín dụng mới, hoặc đăng ký cho phép ngân hàng xét duyệt tự động giúp bạn. Dựa vào các thói quen khi sử dụng thẻ tín dụng, ngân hàng sẽ cân nhắc việc tăng, hoặc giữ nguyên hạn mức tín dụng hiện tại của bạn\n"
        },
        "raw_text": "Tự do lựa chọn hình ảnh phù hợp với cá tính riêng của bạn. Vô tư thực hiện giao dịch trên số dư tài khoản thanh toán của mình  Cho phép in hình ảnh trên thẻ theo nhu cầu của chủ thẻ. Hưởng lãi không kỳ hạn trên số dư tài khoản thanh toán.  Rút tiền mặt dễ dàng  với mạng lưới ATM rộng lớn, thanh toán tại hàng triệu điểm chấp nhận thẻ trên toàn quốc. Rút tiền mặt dễ dàng với mạng lưới ATM rộng lớn, thanh toán tại hàng triệu điểm chấp nhận thẻ trên toàn quốc. Thuận tiện khi thanh toán hóa đơn, chuyển khoản, dễ dàng theo dõi & quản lý mọi giao dịch thẻ qua dịch vụ Ngân hàng điện tử. An toàn, tiện lợi, không cần mang nhiều tiền mặt hàng ngày. Hưởng lãi không kỳ hạn trên số dư tài khoản thanh toán. Tận hưởng đến 50% ưu đãi từ “Happy Zone” như ẩm thực, mua sắm, giải trí,... Cho phép in hình ảnh trên thẻ theo nhu cầu của chủ thẻ. Rút tiền mặt, chuyển khoản, thanh toán hóa đơn, tra cứu số dư và kiểm soát tài khoản dễ dàng với mạng lưới ATM rộng lớn và dịch vụ eBanking. Mua sắm, thanh toán trực tuyến và tại các cửa hàng chấp nhận thẻ trên toàn quốc. Nhận lương và các khoản thu nhập khác (lãi tiết kiệm, cổ tức,...) qua thẻ. - Cá nhân từ 18 tuổi trở lên, không bị mất hoặc hạn chế năng lực hành vi dân sự theo quy định của pháp luật.\n- Trường hợp đối tượng phát hành thẻ là người nước ngoài thì phải được phép cư trú tại Việt Nam với thời hạn từ 12 tháng trở lên.\n- Xem chi tiết Điều kiện & Điều khoản tại đây - Phí phát hành: Miễn phí\n- Phí thường niên: 99.000 đồng/ năm\n- Lãi suất (%/ năm): Hưởng lãi không kỳ hạn trên số dư tài khoản của khách hàng\n- Xem chi tiết tại đây\n - Đăng ký trực tiếp tại Chi nhánh/Phòng Giao dịch HDBank gần nhất (tra cứu mạng lưới HDBank tại đây).\n- CMND/CCCD/ Hộ chiếu còn hiệu lực.\n Để tăng hạn mức nhanh chóng thật ra không khó khăn nếu bạn chứng minh được mình là người sở hữu thẻ tín dụng có trách nhiệm. Cụ thể, xuyên suốt quá trình sử dụng thẻ bạn cần:\n\nLuôn thanh toán dư nợ tín dụng đúng hạn.\nTăng thời gian sở hữu thẻ.\nChi tiêu mua sắm thường xuyên. Hạn mức tín dụng là số tiền tối đa mà tổ chức tín dụng cấp cho bạn để bạn có thể sử dụng trên thẻ tín dụng. Mỗi ngân hàng phát hành thẻ sẽ có hạn mức tín dụng tối thiểu và hạn mức tín dụng tối đa khác nhau cho từng loại thẻ riêng biệt. Thậm chí, khi cùng sử dụng một loại thẻ tín dụng, nhưng hạn mức tín dụng cho từng khách hàng cũng khác nhau.\n Thể hiện màu sắc, cá tính riêng thông qua hình ảnh được tự chọn in trên thẻ\nKhông cần mở tài khoản ngân hàng, tạo thẻ nhanh chóng\nQuản lý chi tiêu hiệu quả, xóa tan nỗi lo về lãi suất và hạn mức thanh toán\nMua sắm thỏa thích, thanh toán dễ dàng\nRút tiền mặt tại tất cả máy ATM của HDBank và trong hệ thống thẻ Napas\nPhạm vi sử dụng: thẻ được sử dụng trong lãnh thổ Việt Nam Tương tự như thẻ ghi nợ và thẻ tín dụng, thẻ trả trước cho phép bạn thực hiện thanh toán mà không cần tiền mặt hay séc. Không như thẻ tín dụng, bạn không thanh toán trước, trả sau với thẻ trả trước. Thẻ trả trước cũng không kết nối trực tiếp với tài khoản ngân hàng như thẻ ghi nợ. Thẻ trả trước không có giá trị nào cho đến khi bạn cho tiền vào thẻ. Thông thường bạn có thể chủ động yêu cầu ngân hàng phát hành thẻ xét duyệt cho bạn một hạn mức tín dụng mới, hoặc đăng ký cho phép ngân hàng xét duyệt tự động giúp bạn. Dựa vào các thói quen khi sử dụng thẻ tín dụng, ngân hàng sẽ cân nhắc việc tăng, hoặc giữ nguyên hạn mức tín dụng hiện tại của bạn"
    },
    {
        "metadata": {
            "card_name": "HDBank Visa",
            "card_image": "https://cdn.hdbank.com.vn/hdbank-file/product/visa_new.jpg",
            "url": "https://hdbank.com.vn/vi/personal/product/detail/the/the-ghi-no/hdbank-visa",
            "card_type": "The Ghi No",
            "category": "banking_cards",
            "bank": "HDBank",
            "last_updated": "2024-11-29"
        },
        "description": "Sở hữu thẻ Visa Debit, khách hàng có thể giao dịch tại trụ ATM, rút tiền mặt, mua hàng online hoặc thanh toán tại các điểm chấp nhận biểu tượng Visa trên phạm vi toàn cầu.",
        "features": {
            "gifts": [
                "Miễn phi phát hành thẻ"
            ],
            "privileges": [
                "Rút tiền mặt tại hàng triệu ATM",
                " ",
                "Không cần mang nhiều tiền mặt ",
                "khi đi công tác nước ngoài.",
                "Hưởng lãi không kỳ hạn\ntrên số dư tài khoản thanh toán.",
                " "
            ],
            "benefits": [
                "Giao dịch và mua sắm trực tuyến thuận tiện tại nhiều website, thanh toán giao dịch qua các ứng dụng di động thời thượng.",
                "Tận hưởng các ưu đãi, chiết khấu thanh toán từ “Happy Zone” của HDBank và trên toàn thế giới.",
                "Không cần mang nhiều tiền mặt khi công tác trong nước và nước ngoài.",
                "Công nghệ mới Contactless cho phép thanh toán tại hàng triệu điểm chấp nhận thẻ (POS/ mPOS) với bảo mật thanh toán 3D Secure.",
                "Mua sắm online tại hàng triệu website chấp nhận thẻ Visa.",
                "Rút tiền mặt tại hàng triệu ATM có logo Visa trên toàn thế giới."
            ]
        },
        "terms_and_conditions": {
            "conditions": "- Cá nhân từ 18 tuổi trở lên, không bị mất hoặc hạn chế năng lực hành vi dân sự theo quy định của pháp luật.\n- Trường hợp đối tượng phát hành thẻ là người nước ngoài thì phải được phép cư trú tại Việt Nam với thời hạn từ 12 tháng trở lên.",
            "fees": "Xem chi tiết tại đây.\n",
            "documents": " - Đăng ký trực tiếp tại Chi nhánh/Phòng Giao dịch HDBank gần nhất (tra cứu mạng lưới HDBank tại đây).\n- CMND/CCCD/ Hộ chiếu còn hiệu lực.\n"
        },
        "faqs": {
            "Bí kíp tăng hạn mức tín dụng": "Để tăng hạn mức nhanh chóng thật ra không khó khăn nếu bạn chứng minh được mình là người sở hữu thẻ tín dụng có trách nhiệm. Cụ thể, xuyên suốt quá trình sử dụng thẻ bạn cần:\n\nLuôn thanh toán dư nợ tín dụng đúng hạn.\nTăng thời gian sở hữu thẻ.\nChi tiêu mua sắm thường xuyên.",
            "Hạn mức thẻ tín dụng là gì?": "Hạn mức tín dụng là số tiền tối đa mà tổ chức tín dụng cấp cho bạn để bạn có thể sử dụng trên thẻ tín dụng. Mỗi ngân hàng phát hành thẻ sẽ có hạn mức tín dụng tối thiểu và hạn mức tín dụng tối đa khác nhau cho từng loại thẻ riêng biệt. Thậm chí, khi cùng sử dụng một loại thẻ tín dụng, nhưng hạn mức tín dụng cho từng khách hàng cũng khác nhau.\n",
            "Tính năng của thẻ trả trước?": "Thể hiện màu sắc, cá tính riêng thông qua hình ảnh được tự chọn in trên thẻ\nKhông cần mở tài khoản ngân hàng, tạo thẻ nhanh chóng\nQuản lý chi tiêu hiệu quả, xóa tan nỗi lo về lãi suất và hạn mức thanh toán\nMua sắm thỏa thích, thanh toán dễ dàng\nRút tiền mặt tại tất cả máy ATM của HDBank và trong hệ thống thẻ Napas\nPhạm vi sử dụng: thẻ được sử dụng trong lãnh thổ Việt Nam",
            "Thẻ trả trước là gì?": "Tương tự như thẻ ghi nợ và thẻ tín dụng, thẻ trả trước cho phép bạn thực hiện thanh toán mà không cần tiền mặt hay séc. Không như thẻ tín dụng, bạn không thanh toán trước, trả sau với thẻ trả trước. Thẻ trả trước cũng không kết nối trực tiếp với tài khoản ngân hàng như thẻ ghi nợ. Thẻ trả trước không có giá trị nào cho đến khi bạn cho tiền vào thẻ.",
            "Làm sao để thay đổi hạn mức thẻ tín dụng": "Thông thường bạn có thể chủ động yêu cầu ngân hàng phát hành thẻ xét duyệt cho bạn một hạn mức tín dụng mới, hoặc đăng ký cho phép ngân hàng xét duyệt tự động giúp bạn. Dựa vào các thói quen khi sử dụng thẻ tín dụng, ngân hàng sẽ cân nhắc việc tăng, hoặc giữ nguyên hạn mức tín dụng hiện tại của bạn\n"
        },
        "raw_text": "Sở hữu thẻ Visa Debit, khách hàng có thể giao dịch tại trụ ATM, rút tiền mặt, mua hàng online hoặc thanh toán tại các điểm chấp nhận biểu tượng Visa trên phạm vi toàn cầu. Miễn phi phát hành thẻ Rút tiền mặt tại hàng triệu ATM   Không cần mang nhiều tiền mặt  khi đi công tác nước ngoài. Hưởng lãi không kỳ hạn\ntrên số dư tài khoản thanh toán.   Giao dịch và mua sắm trực tuyến thuận tiện tại nhiều website, thanh toán giao dịch qua các ứng dụng di động thời thượng. Tận hưởng các ưu đãi, chiết khấu thanh toán từ “Happy Zone” của HDBank và trên toàn thế giới. Không cần mang nhiều tiền mặt khi công tác trong nước và nước ngoài. Công nghệ mới Contactless cho phép thanh toán tại hàng triệu điểm chấp nhận thẻ (POS/ mPOS) với bảo mật thanh toán 3D Secure. Mua sắm online tại hàng triệu website chấp nhận thẻ Visa. Rút tiền mặt tại hàng triệu ATM có logo Visa trên toàn thế giới. - Cá nhân từ 18 tuổi trở lên, không bị mất hoặc hạn chế năng lực hành vi dân sự theo quy định của pháp luật.\n- Trường hợp đối tượng phát hành thẻ là người nước ngoài thì phải được phép cư trú tại Việt Nam với thời hạn từ 12 tháng trở lên. Xem chi tiết tại đây.\n  - Đăng ký trực tiếp tại Chi nhánh/Phòng Giao dịch HDBank gần nhất (tra cứu mạng lưới HDBank tại đây).\n- CMND/CCCD/ Hộ chiếu còn hiệu lực.\n Để tăng hạn mức nhanh chóng thật ra không khó khăn nếu bạn chứng minh được mình là người sở hữu thẻ tín dụng có trách nhiệm. Cụ thể, xuyên suốt quá trình sử dụng thẻ bạn cần:\n\nLuôn thanh toán dư nợ tín dụng đúng hạn.\nTăng thời gian sở hữu thẻ.\nChi tiêu mua sắm thường xuyên. Hạn mức tín dụng là số tiền tối đa mà tổ chức tín dụng cấp cho bạn để bạn có thể sử dụng trên thẻ tín dụng. Mỗi ngân hàng phát hành thẻ sẽ có hạn mức tín dụng tối thiểu và hạn mức tín dụng tối đa khác nhau cho từng loại thẻ riêng biệt. Thậm chí, khi cùng sử dụng một loại thẻ tín dụng, nhưng hạn mức tín dụng cho từng khách hàng cũng khác nhau.\n Thể hiện màu sắc, cá tính riêng thông qua hình ảnh được tự chọn in trên thẻ\nKhông cần mở tài khoản ngân hàng, tạo thẻ nhanh chóng\nQuản lý chi tiêu hiệu quả, xóa tan nỗi lo về lãi suất và hạn mức thanh toán\nMua sắm thỏa thích, thanh toán dễ dàng\nRút tiền mặt tại tất cả máy ATM của HDBank và trong hệ thống thẻ Napas\nPhạm vi sử dụng: thẻ được sử dụng trong lãnh thổ Việt Nam Tương tự như thẻ ghi nợ và thẻ tín dụng, thẻ trả trước cho phép bạn thực hiện thanh toán mà không cần tiền mặt hay séc. Không như thẻ tín dụng, bạn không thanh toán trước, trả sau với thẻ trả trước. Thẻ trả trước cũng không kết nối trực tiếp với tài khoản ngân hàng như thẻ ghi nợ. Thẻ trả trước không có giá trị nào cho đến khi bạn cho tiền vào thẻ. Thông thường bạn có thể chủ động yêu cầu ngân hàng phát hành thẻ xét duyệt cho bạn một hạn mức tín dụng mới, hoặc đăng ký cho phép ngân hàng xét duyệt tự động giúp bạn. Dựa vào các thói quen khi sử dụng thẻ tín dụng, ngân hàng sẽ cân nhắc việc tăng, hoặc giữ nguyên hạn mức tín dụng hiện tại của bạn"
    },
    {
        "metadata": {
            "card_name": "HDBank MasterCard",
            "card_image": "https://cdn.hdbank.com.vn/hdbank-file/product/MC_debit_new.jpg",
            "url": "https://hdbank.com.vn/vi/personal/product/detail/the/the-ghi-no/hdbank-mastercard",
            "card_type": "The Ghi No",
            "category": "banking_cards",
            "bank": "HDBank",
            "last_updated": "2024-11-29"
        },
        "description": "Sở hữu thẻ HDBank MasterCard Debit quý khách được sử dụng số tiền đang có trong tài khoản, bao gồm tài khoản thanh toán, tài khoản tiết kiệm (nếu có). Khách hàng mở thẻ MasterCard Debit không cần chứng minh tài chính như thẻ Credit.",
        "features": {
            "gifts": [
                "Miễn phi phát hành thẻ"
            ],
            "privileges": [
                "Rút tiền mặt tại hàng triệu ATM ",
                " có logo Mastercard trên toàn thế giới.",
                "Không cần mang nhiều tiền mặt",
                "khi đi công tác nước ngoài.",
                "Hưởng lãi không kỳ hạn\ntrên số dư tài khoản thanh toán.",
                " "
            ],
            "benefits": [
                "Không cần mang nhiều tiền mặt khi công tác trong nước và nước ngoài..",
                "Sử dụng được nhiều loại ngoại tệ khác nhau trên thế giới.",
                "Tận hưởng các ưu đãi, chiết khấu thanh toán từ “Happy Zone” của HDBank.",
                "Thanh toán tại hàng triệu cửa hàng chấp nhận thẻ Mastercard tại Việt Nam và trên toàn thế giới.",
                "Chuyển đổi ngoại tệ được hơn 220 loại ngoại tệ khác nhau khi thực hiện giao dịch ở nước ngoài.",
                "Mua sắm online tại hàng triệu website chấp nhận thẻ Mastercard."
            ]
        },
        "terms_and_conditions": {
            "conditions": "- Cá nhân từ 18 tuổi trở lên, không bị mất hoặc hạn chế năng lực hành vi dân sự theo quy định của pháp luật.\n- Trường hợp đối tượng phát hành thẻ là người nước ngoài thì phải được phép cư trú tại Việt Nam với thời hạn từ 12 tháng trở lên.\n- Xem chi tiết Điều kiện & Điều khoản tại đây",
            "fees": "- Phí phát hành: Miễn phí\n- Phí thường niên: 220.000 đồng/ năm\n- Lãi suất (%/ năm): Hưởng lãi không kỳ hạn trên số dư tài khoản của khách hàng\n- Xem chi tiết tại đây\n",
            "documents": "- Đăng ký trực tiếp tại Chi nhánh/Phòng Giao dịch HDBank gần nhất (tra cứu mạng lưới HDBank tại đây).\n- CMND/CCCD/ Hộ chiếu còn hiệu lực.\n"
        },
        "faqs": {
            "Bí kíp tăng hạn mức tín dụng": "Để tăng hạn mức nhanh chóng thật ra không khó khăn nếu bạn chứng minh được mình là người sở hữu thẻ tín dụng có trách nhiệm. Cụ thể, xuyên suốt quá trình sử dụng thẻ bạn cần:\n\nLuôn thanh toán dư nợ tín dụng đúng hạn.\nTăng thời gian sở hữu thẻ.\nChi tiêu mua sắm thường xuyên.",
            "Hạn mức thẻ tín dụng là gì?": "Hạn mức tín dụng là số tiền tối đa mà tổ chức tín dụng cấp cho bạn để bạn có thể sử dụng trên thẻ tín dụng. Mỗi ngân hàng phát hành thẻ sẽ có hạn mức tín dụng tối thiểu và hạn mức tín dụng tối đa khác nhau cho từng loại thẻ riêng biệt. Thậm chí, khi cùng sử dụng một loại thẻ tín dụng, nhưng hạn mức tín dụng cho từng khách hàng cũng khác nhau.\n",
            "Tính năng của thẻ trả trước?": "Thể hiện màu sắc, cá tính riêng thông qua hình ảnh được tự chọn in trên thẻ\nKhông cần mở tài khoản ngân hàng, tạo thẻ nhanh chóng\nQuản lý chi tiêu hiệu quả, xóa tan nỗi lo về lãi suất và hạn mức thanh toán\nMua sắm thỏa thích, thanh toán dễ dàng\nRút tiền mặt tại tất cả máy ATM của HDBank và trong hệ thống thẻ Napas\nPhạm vi sử dụng: thẻ được sử dụng trong lãnh thổ Việt Nam",
            "Thẻ trả trước là gì?": "Tương tự như thẻ ghi nợ và thẻ tín dụng, thẻ trả trước cho phép bạn thực hiện thanh toán mà không cần tiền mặt hay séc. Không như thẻ tín dụng, bạn không thanh toán trước, trả sau với thẻ trả trước. Thẻ trả trước cũng không kết nối trực tiếp với tài khoản ngân hàng như thẻ ghi nợ. Thẻ trả trước không có giá trị nào cho đến khi bạn cho tiền vào thẻ.",
            "Làm sao để thay đổi hạn mức thẻ tín dụng": "Thông thường bạn có thể chủ động yêu cầu ngân hàng phát hành thẻ xét duyệt cho bạn một hạn mức tín dụng mới, hoặc đăng ký cho phép ngân hàng xét duyệt tự động giúp bạn. Dựa vào các thói quen khi sử dụng thẻ tín dụng, ngân hàng sẽ cân nhắc việc tăng, hoặc giữ nguyên hạn mức tín dụng hiện tại của bạn\n"
        },
        "raw_text": "Sở hữu thẻ HDBank MasterCard Debit quý khách được sử dụng số tiền đang có trong tài khoản, bao gồm tài khoản thanh toán, tài khoản tiết kiệm (nếu có). Khách hàng mở thẻ MasterCard Debit không cần chứng minh tài chính như thẻ Credit. Miễn phi phát hành thẻ Rút tiền mặt tại hàng triệu ATM   có logo Mastercard trên toàn thế giới. Không cần mang nhiều tiền mặt khi đi công tác nước ngoài. Hưởng lãi không kỳ hạn\ntrên số dư tài khoản thanh toán.   Không cần mang nhiều tiền mặt khi công tác trong nước và nước ngoài.. Sử dụng được nhiều loại ngoại tệ khác nhau trên thế giới. Tận hưởng các ưu đãi, chiết khấu thanh toán từ “Happy Zone” của HDBank. Thanh toán tại hàng triệu cửa hàng chấp nhận thẻ Mastercard tại Việt Nam và trên toàn thế giới. Chuyển đổi ngoại tệ được hơn 220 loại ngoại tệ khác nhau khi thực hiện giao dịch ở nước ngoài. Mua sắm online tại hàng triệu website chấp nhận thẻ Mastercard. - Cá nhân từ 18 tuổi trở lên, không bị mất hoặc hạn chế năng lực hành vi dân sự theo quy định của pháp luật.\n- Trường hợp đối tượng phát hành thẻ là người nước ngoài thì phải được phép cư trú tại Việt Nam với thời hạn từ 12 tháng trở lên.\n- Xem chi tiết Điều kiện & Điều khoản tại đây - Phí phát hành: Miễn phí\n- Phí thường niên: 220.000 đồng/ năm\n- Lãi suất (%/ năm): Hưởng lãi không kỳ hạn trên số dư tài khoản của khách hàng\n- Xem chi tiết tại đây\n - Đăng ký trực tiếp tại Chi nhánh/Phòng Giao dịch HDBank gần nhất (tra cứu mạng lưới HDBank tại đây).\n- CMND/CCCD/ Hộ chiếu còn hiệu lực.\n Để tăng hạn mức nhanh chóng thật ra không khó khăn nếu bạn chứng minh được mình là người sở hữu thẻ tín dụng có trách nhiệm. Cụ thể, xuyên suốt quá trình sử dụng thẻ bạn cần:\n\nLuôn thanh toán dư nợ tín dụng đúng hạn.\nTăng thời gian sở hữu thẻ.\nChi tiêu mua sắm thường xuyên. Hạn mức tín dụng là số tiền tối đa mà tổ chức tín dụng cấp cho bạn để bạn có thể sử dụng trên thẻ tín dụng. Mỗi ngân hàng phát hành thẻ sẽ có hạn mức tín dụng tối thiểu và hạn mức tín dụng tối đa khác nhau cho từng loại thẻ riêng biệt. Thậm chí, khi cùng sử dụng một loại thẻ tín dụng, nhưng hạn mức tín dụng cho từng khách hàng cũng khác nhau.\n Thể hiện màu sắc, cá tính riêng thông qua hình ảnh được tự chọn in trên thẻ\nKhông cần mở tài khoản ngân hàng, tạo thẻ nhanh chóng\nQuản lý chi tiêu hiệu quả, xóa tan nỗi lo về lãi suất và hạn mức thanh toán\nMua sắm thỏa thích, thanh toán dễ dàng\nRút tiền mặt tại tất cả máy ATM của HDBank và trong hệ thống thẻ Napas\nPhạm vi sử dụng: thẻ được sử dụng trong lãnh thổ Việt Nam Tương tự như thẻ ghi nợ và thẻ tín dụng, thẻ trả trước cho phép bạn thực hiện thanh toán mà không cần tiền mặt hay séc. Không như thẻ tín dụng, bạn không thanh toán trước, trả sau với thẻ trả trước. Thẻ trả trước cũng không kết nối trực tiếp với tài khoản ngân hàng như thẻ ghi nợ. Thẻ trả trước không có giá trị nào cho đến khi bạn cho tiền vào thẻ. Thông thường bạn có thể chủ động yêu cầu ngân hàng phát hành thẻ xét duyệt cho bạn một hạn mức tín dụng mới, hoặc đăng ký cho phép ngân hàng xét duyệt tự động giúp bạn. Dựa vào các thói quen khi sử dụng thẻ tín dụng, ngân hàng sẽ cân nhắc việc tăng, hoặc giữ nguyên hạn mức tín dụng hiện tại của bạn"
    },
    {
        "metadata": {
            "card_name": "HDBank Gift Card",
            "card_image": "https://cdn.hdbank.com.vn/hdbank-file/product/Napas_new.jpg",
            "url": "https://hdbank.com.vn/vi/personal/product/detail/the/the-tra-truoc/hdbank-gift-card",
            "card_type": "The Tra Truoc",
            "category": "banking_cards",
            "bank": "HDBank",
            "last_updated": "2024-11-29"
        },
        "description": "Không cần đến ngân hàng mở tài khoản, quản lý chi tiêu hiệu quả, xóa tan nỗi lo về lãi suất.",
        "features": {
            "gifts": [
                "Miễn phi phát hành thẻ"
            ],
            "privileges": [
                "Không cần mở tài khoản ngân hàng",
                " ",
                "Tạo thẻ nhanh chóng",
                " ",
                "Thủ tục mở thẻ đơn giản, dễ dàng.",
                " "
            ],
            "benefits": [
                "Một món quà hoàn hảo, thiết thực.",
                "Quản lý chi tiêu hiệu quả, xóa tan nỗi lo về Lãi suất và hạn mức thanh toán.",
                "Không cần mở tài khoản ngân hàng, tạo thẻ nhanh chóng.",
                "Thanh toán hàng hóa, dịch vụ tại Đơn vị Chấp nhận Thẻ (ĐVCNT) thông qua POS: Khi thanh toán tại ĐVCNT thông qua POS, Quý khách có thể được yêu cầu nhập mã PIN và ký vào hóa đơn. Quý khách cần kiểm tra thông tin hóa đơn và nên giữ lại để kiểm tra, đối chiếu khi cần thiết."
            ]
        },
        "terms_and_conditions": {
            "conditions": "- Cá nhân từ 18 tuổi trở lên, không bị mất hoặc hạn chế năng lực hành vi dân sự theo quy định của pháp luật.\n- Trường hợp đối tượng phát hành thẻ là người nước ngoài thì phải được phép cư trú tại Việt Nam với thời hạn từ 12 tháng trở lên.\n- Xem chi tiết Điều kiện & Điều khoản tại đây",
            "fees": "- Phí phát hành: 99.000 đồng\n- Phí thường niên: 20.000 đồng/ năm\n- Xem chi tiết tại đây\n",
            "documents": "Giấy đề nghị kiêm HĐ phát hành thẻ\n"
        },
        "faqs": {
            "Bí kíp tăng hạn mức tín dụng": "Để tăng hạn mức nhanh chóng thật ra không khó khăn nếu bạn chứng minh được mình là người sở hữu thẻ tín dụng có trách nhiệm. Cụ thể, xuyên suốt quá trình sử dụng thẻ bạn cần:\n\nLuôn thanh toán dư nợ tín dụng đúng hạn.\nTăng thời gian sở hữu thẻ.\nChi tiêu mua sắm thường xuyên.",
            "Hạn mức thẻ tín dụng là gì?": "Hạn mức tín dụng là số tiền tối đa mà tổ chức tín dụng cấp cho bạn để bạn có thể sử dụng trên thẻ tín dụng. Mỗi ngân hàng phát hành thẻ sẽ có hạn mức tín dụng tối thiểu và hạn mức tín dụng tối đa khác nhau cho từng loại thẻ riêng biệt. Thậm chí, khi cùng sử dụng một loại thẻ tín dụng, nhưng hạn mức tín dụng cho từng khách hàng cũng khác nhau.\n",
            "Tính năng của thẻ trả trước?": "Thể hiện màu sắc, cá tính riêng thông qua hình ảnh được tự chọn in trên thẻ\nKhông cần mở tài khoản ngân hàng, tạo thẻ nhanh chóng\nQuản lý chi tiêu hiệu quả, xóa tan nỗi lo về lãi suất và hạn mức thanh toán\nMua sắm thỏa thích, thanh toán dễ dàng\nRút tiền mặt tại tất cả máy ATM của HDBank và trong hệ thống thẻ Napas\nPhạm vi sử dụng: thẻ được sử dụng trong lãnh thổ Việt Nam",
            "Thẻ trả trước là gì?": "Tương tự như thẻ ghi nợ và thẻ tín dụng, thẻ trả trước cho phép bạn thực hiện thanh toán mà không cần tiền mặt hay séc. Không như thẻ tín dụng, bạn không thanh toán trước, trả sau với thẻ trả trước. Thẻ trả trước cũng không kết nối trực tiếp với tài khoản ngân hàng như thẻ ghi nợ. Thẻ trả trước không có giá trị nào cho đến khi bạn cho tiền vào thẻ.",
            "Làm sao để thay đổi hạn mức thẻ tín dụng": "Thông thường bạn có thể chủ động yêu cầu ngân hàng phát hành thẻ xét duyệt cho bạn một hạn mức tín dụng mới, hoặc đăng ký cho phép ngân hàng xét duyệt tự động giúp bạn. Dựa vào các thói quen khi sử dụng thẻ tín dụng, ngân hàng sẽ cân nhắc việc tăng, hoặc giữ nguyên hạn mức tín dụng hiện tại của bạn\n"
        },
        "raw_text": "Không cần đến ngân hàng mở tài khoản, quản lý chi tiêu hiệu quả, xóa tan nỗi lo về lãi suất. Miễn phi phát hành thẻ Không cần mở tài khoản ngân hàng   Tạo thẻ nhanh chóng   Thủ tục mở thẻ đơn giản, dễ dàng.   Một món quà hoàn hảo, thiết thực. Quản lý chi tiêu hiệu quả, xóa tan nỗi lo về Lãi suất và hạn mức thanh toán. Không cần mở tài khoản ngân hàng, tạo thẻ nhanh chóng. Thanh toán hàng hóa, dịch vụ tại Đơn vị Chấp nhận Thẻ (ĐVCNT) thông qua POS: Khi thanh toán tại ĐVCNT thông qua POS, Quý khách có thể được yêu cầu nhập mã PIN và ký vào hóa đơn. Quý khách cần kiểm tra thông tin hóa đơn và nên giữ lại để kiểm tra, đối chiếu khi cần thiết. - Cá nhân từ 18 tuổi trở lên, không bị mất hoặc hạn chế năng lực hành vi dân sự theo quy định của pháp luật.\n- Trường hợp đối tượng phát hành thẻ là người nước ngoài thì phải được phép cư trú tại Việt Nam với thời hạn từ 12 tháng trở lên.\n- Xem chi tiết Điều kiện & Điều khoản tại đây - Phí phát hành: 99.000 đồng\n- Phí thường niên: 20.000 đồng/ năm\n- Xem chi tiết tại đây\n Giấy đề nghị kiêm HĐ phát hành thẻ\n Để tăng hạn mức nhanh chóng thật ra không khó khăn nếu bạn chứng minh được mình là người sở hữu thẻ tín dụng có trách nhiệm. Cụ thể, xuyên suốt quá trình sử dụng thẻ bạn cần:\n\nLuôn thanh toán dư nợ tín dụng đúng hạn.\nTăng thời gian sở hữu thẻ.\nChi tiêu mua sắm thường xuyên. Hạn mức tín dụng là số tiền tối đa mà tổ chức tín dụng cấp cho bạn để bạn có thể sử dụng trên thẻ tín dụng. Mỗi ngân hàng phát hành thẻ sẽ có hạn mức tín dụng tối thiểu và hạn mức tín dụng tối đa khác nhau cho từng loại thẻ riêng biệt. Thậm chí, khi cùng sử dụng một loại thẻ tín dụng, nhưng hạn mức tín dụng cho từng khách hàng cũng khác nhau.\n Thể hiện màu sắc, cá tính riêng thông qua hình ảnh được tự chọn in trên thẻ\nKhông cần mở tài khoản ngân hàng, tạo thẻ nhanh chóng\nQuản lý chi tiêu hiệu quả, xóa tan nỗi lo về lãi suất và hạn mức thanh toán\nMua sắm thỏa thích, thanh toán dễ dàng\nRút tiền mặt tại tất cả máy ATM của HDBank và trong hệ thống thẻ Napas\nPhạm vi sử dụng: thẻ được sử dụng trong lãnh thổ Việt Nam Tương tự như thẻ ghi nợ và thẻ tín dụng, thẻ trả trước cho phép bạn thực hiện thanh toán mà không cần tiền mặt hay séc. Không như thẻ tín dụng, bạn không thanh toán trước, trả sau với thẻ trả trước. Thẻ trả trước cũng không kết nối trực tiếp với tài khoản ngân hàng như thẻ ghi nợ. Thẻ trả trước không có giá trị nào cho đến khi bạn cho tiền vào thẻ. Thông thường bạn có thể chủ động yêu cầu ngân hàng phát hành thẻ xét duyệt cho bạn một hạn mức tín dụng mới, hoặc đăng ký cho phép ngân hàng xét duyệt tự động giúp bạn. Dựa vào các thói quen khi sử dụng thẻ tín dụng, ngân hàng sẽ cân nhắc việc tăng, hoặc giữ nguyên hạn mức tín dụng hiện tại của bạn"
    },
    {
        "metadata": {
            "card_name": "HDBank MyCard",
            "card_image": "https://cdn.hdbank.com.vn/hdbank-file/product/mycard_new.jpg",
            "url": "https://hdbank.com.vn/vi/personal/product/detail/the/the-tra-truoc/hdbank-mycard",
            "card_type": "The Tra Truoc",
            "category": "banking_cards",
            "bank": "HDBank",
            "last_updated": "2024-11-29"
        },
        "description": "Tự do lựa chọn hình ảnh phù hợp với cá tính riêng của bạn. Không cần đến ngân hàng mở tài khoản, quản lý chi tiêu hiệu quả, xóa tan nỗi lo về lãi suất.",
        "features": {
            "gifts": [
                "Miễn phí phát hành thẻ"
            ],
            "privileges": [
                "Không cần mở tài khoản ngân hàng",
                " ",
                "Tạo thẻ nhanh chóng",
                " ",
                "Thủ tục mở thẻ đơn giản, dễ dàng.",
                " "
            ],
            "benefits": [
                "Không cần mở tài khoản ngân hàng, tạo thẻ nhanh chóng.",
                "Quản lý chi tiêu hiệu quả, xóa tan nỗi lo về lãi suất và hạn mức thanh toán.",
                "Thủ tục thanh toán đơn giản, dễ dàng.",
                "Rút tiền mặt tại tất cả máy ATM của HDBank và trong hệ thống thẻ Napas.",
                "Phạm vi sử dụng: thẻ được sử dụng trong lãnh thổ Việt Nam.",
                "Thanh toán hàng hóa, dịch vụ tại Đơn vị Chấp nhận Thẻ (ĐVCNT) thông qua POS: Khi thanh toán tại ĐVCNT thông qua POS, Quý khách có thể được yêu cầu nhập mã PIN và ký vào hóa đơn. Quý khách cần kiểm tra thông tin hóa đơn và nên giữ lại để kiểm tra, đối chiếu khi cần thiết.",
                "Rút tiền mặt tại ATM :",
                "Trình tự thực hiện các bước rút tiền tại các máy ATM có thể thay đổi hoặc bổ sung thêm tùy vào cài đặt thiết bị của từng tổ chức.",
                "Nếu quý khách nhập sai số PIN 03 lần thì hệ thống sẽ từ chối và khoá thẻ.",
                "Nếu thẻ bị nuốt hoặc bị mất phải báo ngay cho HDBank để được hướng dẫn các thủ tục cần thiết."
            ]
        },
        "terms_and_conditions": {
            "conditions": "- Cá nhân từ 18 tuổi trở lên, không bị mất hoặc hạn chế năng lực hành vi dân sự theo quy định của pháp luật.\n- Trường hợp đối tượng phát hành thẻ là người nước ngoài thì phải được phép cư trú tại Việt Nam với thời hạn từ 12 tháng trở lên.\n- Xem chi tiết Điều kiện & Điều khoản tại đây",
            "fees": "- Phí phát hành: 99.000 đồng\n- Phí thường niên: 20.000 đồng/ năm\n- Xem chi tiết tại đây\n",
            "documents": "Giấy đề nghị kiêm HĐ phát hành thẻ\n"
        },
        "faqs": {
            "Bí kíp tăng hạn mức tín dụng": "Để tăng hạn mức nhanh chóng thật ra không khó khăn nếu bạn chứng minh được mình là người sở hữu thẻ tín dụng có trách nhiệm. Cụ thể, xuyên suốt quá trình sử dụng thẻ bạn cần:\n\nLuôn thanh toán dư nợ tín dụng đúng hạn.\nTăng thời gian sở hữu thẻ.\nChi tiêu mua sắm thường xuyên.",
            "Hạn mức thẻ tín dụng là gì?": "Hạn mức tín dụng là số tiền tối đa mà tổ chức tín dụng cấp cho bạn để bạn có thể sử dụng trên thẻ tín dụng. Mỗi ngân hàng phát hành thẻ sẽ có hạn mức tín dụng tối thiểu và hạn mức tín dụng tối đa khác nhau cho từng loại thẻ riêng biệt. Thậm chí, khi cùng sử dụng một loại thẻ tín dụng, nhưng hạn mức tín dụng cho từng khách hàng cũng khác nhau.\n",
            "Tính năng của thẻ trả trước?": "Thể hiện màu sắc, cá tính riêng thông qua hình ảnh được tự chọn in trên thẻ\nKhông cần mở tài khoản ngân hàng, tạo thẻ nhanh chóng\nQuản lý chi tiêu hiệu quả, xóa tan nỗi lo về lãi suất và hạn mức thanh toán\nMua sắm thỏa thích, thanh toán dễ dàng\nRút tiền mặt tại tất cả máy ATM của HDBank và trong hệ thống thẻ Napas\nPhạm vi sử dụng: thẻ được sử dụng trong lãnh thổ Việt Nam",
            "Thẻ trả trước là gì?": "Tương tự như thẻ ghi nợ và thẻ tín dụng, thẻ trả trước cho phép bạn thực hiện thanh toán mà không cần tiền mặt hay séc. Không như thẻ tín dụng, bạn không thanh toán trước, trả sau với thẻ trả trước. Thẻ trả trước cũng không kết nối trực tiếp với tài khoản ngân hàng như thẻ ghi nợ. Thẻ trả trước không có giá trị nào cho đến khi bạn cho tiền vào thẻ.",
            "Làm sao để thay đổi hạn mức thẻ tín dụng": "Thông thường bạn có thể chủ động yêu cầu ngân hàng phát hành thẻ xét duyệt cho bạn một hạn mức tín dụng mới, hoặc đăng ký cho phép ngân hàng xét duyệt tự động giúp bạn. Dựa vào các thói quen khi sử dụng thẻ tín dụng, ngân hàng sẽ cân nhắc việc tăng, hoặc giữ nguyên hạn mức tín dụng hiện tại của bạn\n"
        },
        "raw_text": "Tự do lựa chọn hình ảnh phù hợp với cá tính riêng của bạn. Không cần đến ngân hàng mở tài khoản, quản lý chi tiêu hiệu quả, xóa tan nỗi lo về lãi suất. Miễn phí phát hành thẻ Không cần mở tài khoản ngân hàng   Tạo thẻ nhanh chóng   Thủ tục mở thẻ đơn giản, dễ dàng.   Không cần mở tài khoản ngân hàng, tạo thẻ nhanh chóng. Quản lý chi tiêu hiệu quả, xóa tan nỗi lo về lãi suất và hạn mức thanh toán. Thủ tục thanh toán đơn giản, dễ dàng. Rút tiền mặt tại tất cả máy ATM của HDBank và trong hệ thống thẻ Napas. Phạm vi sử dụng: thẻ được sử dụng trong lãnh thổ Việt Nam. Thanh toán hàng hóa, dịch vụ tại Đơn vị Chấp nhận Thẻ (ĐVCNT) thông qua POS: Khi thanh toán tại ĐVCNT thông qua POS, Quý khách có thể được yêu cầu nhập mã PIN và ký vào hóa đơn. Quý khách cần kiểm tra thông tin hóa đơn và nên giữ lại để kiểm tra, đối chiếu khi cần thiết. Rút tiền mặt tại ATM : Trình tự thực hiện các bước rút tiền tại các máy ATM có thể thay đổi hoặc bổ sung thêm tùy vào cài đặt thiết bị của từng tổ chức. Nếu quý khách nhập sai số PIN 03 lần thì hệ thống sẽ từ chối và khoá thẻ. Nếu thẻ bị nuốt hoặc bị mất phải báo ngay cho HDBank để được hướng dẫn các thủ tục cần thiết. - Cá nhân từ 18 tuổi trở lên, không bị mất hoặc hạn chế năng lực hành vi dân sự theo quy định của pháp luật.\n- Trường hợp đối tượng phát hành thẻ là người nước ngoài thì phải được phép cư trú tại Việt Nam với thời hạn từ 12 tháng trở lên.\n- Xem chi tiết Điều kiện & Điều khoản tại đây - Phí phát hành: 99.000 đồng\n- Phí thường niên: 20.000 đồng/ năm\n- Xem chi tiết tại đây\n Giấy đề nghị kiêm HĐ phát hành thẻ\n Để tăng hạn mức nhanh chóng thật ra không khó khăn nếu bạn chứng minh được mình là người sở hữu thẻ tín dụng có trách nhiệm. Cụ thể, xuyên suốt quá trình sử dụng thẻ bạn cần:\n\nLuôn thanh toán dư nợ tín dụng đúng hạn.\nTăng thời gian sở hữu thẻ.\nChi tiêu mua sắm thường xuyên. Hạn mức tín dụng là số tiền tối đa mà tổ chức tín dụng cấp cho bạn để bạn có thể sử dụng trên thẻ tín dụng. Mỗi ngân hàng phát hành thẻ sẽ có hạn mức tín dụng tối thiểu và hạn mức tín dụng tối đa khác nhau cho từng loại thẻ riêng biệt. Thậm chí, khi cùng sử dụng một loại thẻ tín dụng, nhưng hạn mức tín dụng cho từng khách hàng cũng khác nhau.\n Thể hiện màu sắc, cá tính riêng thông qua hình ảnh được tự chọn in trên thẻ\nKhông cần mở tài khoản ngân hàng, tạo thẻ nhanh chóng\nQuản lý chi tiêu hiệu quả, xóa tan nỗi lo về lãi suất và hạn mức thanh toán\nMua sắm thỏa thích, thanh toán dễ dàng\nRút tiền mặt tại tất cả máy ATM của HDBank và trong hệ thống thẻ Napas\nPhạm vi sử dụng: thẻ được sử dụng trong lãnh thổ Việt Nam Tương tự như thẻ ghi nợ và thẻ tín dụng, thẻ trả trước cho phép bạn thực hiện thanh toán mà không cần tiền mặt hay séc. Không như thẻ tín dụng, bạn không thanh toán trước, trả sau với thẻ trả trước. Thẻ trả trước cũng không kết nối trực tiếp với tài khoản ngân hàng như thẻ ghi nợ. Thẻ trả trước không có giá trị nào cho đến khi bạn cho tiền vào thẻ. Thông thường bạn có thể chủ động yêu cầu ngân hàng phát hành thẻ xét duyệt cho bạn một hạn mức tín dụng mới, hoặc đăng ký cho phép ngân hàng xét duyệt tự động giúp bạn. Dựa vào các thói quen khi sử dụng thẻ tín dụng, ngân hàng sẽ cân nhắc việc tăng, hoặc giữ nguyên hạn mức tín dụng hiện tại của bạn"
    }
]